MINIOB2025 CREATE VIEW SETUP
CREATE TABLE VIEW_T1(ID INT, AGE INT, NAME CHAR);
SUCCESS
CREATE TABLE VIEW_T2(ID INT, SCORE INT, TAG CHAR);
SUCCESS
INSERT INTO VIEW_T1 VALUES(1, 10, 'A');
SUCCESS
INSERT INTO VIEW_T1 VALUES(2, 20, 'B');
SUCCESS
INSERT INTO VIEW_T1 VALUES(3, 30, 'C');
SUCCESS
INSERT INTO VIEW_T2 VALUES(1, 100, 'X');
SUCCESS
INSERT INTO VIEW_T2 VALUES(2, 200, 'Y');
SUCCESS

SIMPLE VIEW SELECT
CREATE VIEW VIEW_SIMPLE AS SELECT ID, AGE FROM VIEW_T1;
SUCCESS
SELECT * FROM VIEW_SIMPLE;
1 | 10
2 | 20
3 | 30
ID | AGE
INSERT INTO VIEW_SIMPLE(ID, AGE) VALUES(4, 40);
SUCCESS
SELECT * FROM VIEW_T1;
1 | 10 | A
2 | 20 | B
3 | 30 | C
4 | 40 | NULL
ID | AGE | NAME
UPDATE VIEW_SIMPLE SET AGE=41 WHERE ID=4;
SUCCESS
SELECT AGE FROM VIEW_T1 WHERE ID=4;
AGE
41
DELETE FROM VIEW_SIMPLE WHERE ID=4;
SUCCESS
SELECT * FROM VIEW_T1;
1 | 10 | A
2 | 20 | B
3 | 30 | C
ID | AGE | NAME

VIEW INSERT COUNT STAYS CURRENT
CREATE TABLE CREATE_VIEW_T1(ID INT, AGE INT, NAME CHAR(10));
SUCCESS
INSERT INTO CREATE_VIEW_T1 VALUES(10, 10, 'SEED1');
SUCCESS
INSERT INTO CREATE_VIEW_T1 VALUES(20, 20, 'SEED2');
SUCCESS
CREATE VIEW CREATE_VIEW_V1 AS SELECT * FROM CREATE_VIEW_T1;
SUCCESS
CREATE VIEW CREATE_VIEW_V2(ID, AGE) AS SELECT ID, AGE FROM CREATE_VIEW_T1;
SUCCESS
INSERT INTO CREATE_VIEW_V1 VALUES(193, 193, 'TJ4JHV');
SUCCESS
INSERT INTO CREATE_VIEW_V1 VALUES(83, 83, '2DLDAT9GLO');
SUCCESS
INSERT INTO CREATE_VIEW_V1 VALUES(177, 177, 'Q09KYCS');
SUCCESS
SELECT COUNT(*) FROM CREATE_VIEW_V1;
COUNT(*)
5
UPDATE CREATE_VIEW_V1 SET AGE=120 WHERE ID=193;
SUCCESS
DELETE FROM CREATE_VIEW_V1 WHERE ID=83;
SUCCESS
SELECT SUM(AGE) FROM CREATE_VIEW_V1;
SUM(AGE)
327

MULTI-TABLE VIEW DML REJECTED
CREATE TABLE CREATE_VIEW_T2(ID INT, AGE INT, NAME CHAR(10));
SUCCESS
INSERT INTO CREATE_VIEW_T1 VALUES(34, 34, 'T034');
SUCCESS
INSERT INTO CREATE_VIEW_T1 VALUES(114, 114, 'T114');
SUCCESS
INSERT INTO CREATE_VIEW_T1 VALUES(120, 120, 'T120');
SUCCESS
INSERT INTO CREATE_VIEW_T1 VALUES(126, 126, 'T126');
SUCCESS
INSERT INTO CREATE_VIEW_T1 VALUES(167, 167, 'T167');
SUCCESS
INSERT INTO CREATE_VIEW_T2 VALUES(34, 34, 'U034');
SUCCESS
INSERT INTO CREATE_VIEW_T2 VALUES(114, 114, 'U114');
SUCCESS
INSERT INTO CREATE_VIEW_T2 VALUES(120, 120, 'U120');
SUCCESS
INSERT INTO CREATE_VIEW_T2 VALUES(126, 126, 'U126');
SUCCESS
INSERT INTO CREATE_VIEW_T2 VALUES(167, 167, 'U167');
SUCCESS
CREATE VIEW CREATE_VIEW_V4 AS SELECT T1.ID AS ID, T1.AGE AS AGE, T2.NAME AS NAME FROM CREATE_VIEW_T1 T1, CREATE_VIEW_T2 T2 WHERE T1.ID=T2.ID;
SUCCESS
SELECT COUNT(*) FROM CREATE_VIEW_V4;
COUNT(*)
5
SELECT COUNT(ID) FROM CREATE_VIEW_V4;
COUNT(ID)
5
SELECT SUM(AGE) FROM CREATE_VIEW_V4;
SUM(AGE)
561
SELECT COUNT(NAME) FROM CREATE_VIEW_V4;
COUNT(NAME)
5
INSERT INTO CREATE_VIEW_V4 VALUES(114, 114, 'DYQY03');
SUCCESS
INSERT INTO CREATE_VIEW_V4 VALUES(135, 135, '7WBA');
SUCCESS
INSERT INTO CREATE_VIEW_V4(ID, AGE) VALUES(34, 34);
SUCCESS
INSERT INTO CREATE_VIEW_V4 VALUES(156, 156, 'A');
SUCCESS
INSERT INTO CREATE_VIEW_V4(ID, AGE) VALUES(43, 43);
SUCCESS
UPDATE CREATE_VIEW_V4 SET AGE=59 WHERE ID=120;
SUCCESS
UPDATE CREATE_VIEW_V4 SET AGE=37, NAME='HFZFH2J4' WHERE ID=126;
SUCCESS
UPDATE CREATE_VIEW_V4 SET AGE=165 WHERE ID=101;
SUCCESS
DELETE FROM CREATE_VIEW_V4 WHERE ID=167;
FAILURE

VIEW STRESS COUNT AND SUM
CREATE TABLE CREATE_VIEW_STRESS_T1(ID INT, AGE INT, NAME CHAR(10));
SUCCESS
CREATE VIEW CREATE_VIEW_STRESS_V1 AS SELECT * FROM CREATE_VIEW_STRESS_T1;
SUCCESS
INSERT INTO CREATE_VIEW_STRESS_V1 VALUES(1, 52, 'S001');
SUCCESS
INSERT INTO CREATE_VIEW_STRESS_V1 VALUES(2, 52, 'S002');
SUCCESS
INSERT INTO CREATE_VIEW_STRESS_V1 VALUES(3, 52, 'S003');
SUCCESS
INSERT INTO CREATE_VIEW_STRESS_V1 VALUES(4, 52, 'S004');
SUCCESS
INSERT INTO CREATE_VIEW_STRESS_V1 VALUES(5, 52, 'S005');
SUCCESS
INSERT INTO CREATE_VIEW_STRESS_V1 VALUES(6, 52, 'S006');
SUCCESS
INSERT INTO CREATE_VIEW_STRESS_V1 VALUES(7, 52, 'S007');
SUCCESS
INSERT INTO CREATE_VIEW_STRESS_V1 VALUES(8, 52, 'S008');
SUCCESS
INSERT INTO CREATE_VIEW_STRESS_V1 VALUES(9, 52, 'S009');
SUCCESS
INSERT INTO CREATE_VIEW_STRESS_V1 VALUES(10, 52, 'S010');
SUCCESS
INSERT INTO CREATE_VIEW_STRESS_V1 VALUES(11, 52, 'S011');
SUCCESS
INSERT INTO CREATE_VIEW_STRESS_V1 VALUES(12, 52, 'S012');
SUCCESS
INSERT INTO CREATE_VIEW_STRESS_V1 VALUES(13, 52, 'S013');
SUCCESS
INSERT INTO CREATE_VIEW_STRESS_V1 VALUES(14, 52, 'S014');
SUCCESS
INSERT INTO CREATE_VIEW_STRESS_V1 VALUES(15, 52, 'S015');
SUCCESS
INSERT INTO CREATE_VIEW_STRESS_V1 VALUES(16, 52, 'S016');
SUCCESS
INSERT INTO CREATE_VIEW_STRESS_V1 VALUES(17, 52, 'S017');
SUCCESS
INSERT INTO CREATE_VIEW_STRESS_V1 VALUES(18, 52, 'S018');
SUCCESS
INSERT INTO CREATE_VIEW_STRESS_V1 VALUES(19, 52, 'S019');
SUCCESS
INSERT INTO CREATE_VIEW_STRESS_V1 VALUES(20, 52, 'S020');
SUCCESS
INSERT INTO CREATE_VIEW_STRESS_V1 VALUES(21, 52, 'S021');
SUCCESS
INSERT INTO CREATE_VIEW_STRESS_V1 VALUES(22, 52, 'S022');
SUCCESS
INSERT INTO CREATE_VIEW_STRESS_V1 VALUES(23, 52, 'S023');
SUCCESS
INSERT INTO CREATE_VIEW_STRESS_V1 VALUES(24, 52, 'S024');
SUCCESS
INSERT INTO CREATE_VIEW_STRESS_V1 VALUES(25, 52, 'S025');
SUCCESS
INSERT INTO CREATE_VIEW_STRESS_V1 VALUES(26, 52, 'S026');
SUCCESS
INSERT INTO CREATE_VIEW_STRESS_V1 VALUES(27, 52, 'S027');
SUCCESS
INSERT INTO CREATE_VIEW_STRESS_V1 VALUES(28, 52, 'S028');
SUCCESS
INSERT INTO CREATE_VIEW_STRESS_V1 VALUES(29, 52, 'S029');
SUCCESS
INSERT INTO CREATE_VIEW_STRESS_V1 VALUES(30, 52, 'S030');
SUCCESS
INSERT INTO CREATE_VIEW_STRESS_V1 VALUES(31, 52, 'S031');
SUCCESS
INSERT INTO CREATE_VIEW_STRESS_V1 VALUES(32, 52, 'S032');
SUCCESS
INSERT INTO CREATE_VIEW_STRESS_V1 VALUES(33, 52, 'S033');
SUCCESS
INSERT INTO CREATE_VIEW_STRESS_V1 VALUES(34, 52, 'S034');
SUCCESS
INSERT INTO CREATE_VIEW_STRESS_V1 VALUES(35, 52, 'S035');
SUCCESS
INSERT INTO CREATE_VIEW_STRESS_V1 VALUES(36, 52, 'S036');
SUCCESS
INSERT INTO CREATE_VIEW_STRESS_V1 VALUES(37, 52, 'S037');
SUCCESS
INSERT INTO CREATE_VIEW_STRESS_V1 VALUES(38, 52, 'S038');
SUCCESS
INSERT INTO CREATE_VIEW_STRESS_V1 VALUES(39, 52, 'S039');
SUCCESS
INSERT INTO CREATE_VIEW_STRESS_V1 VALUES(40, 52, 'S040');
SUCCESS
INSERT INTO CREATE_VIEW_STRESS_V1 VALUES(41, 52, 'S041');
SUCCESS
INSERT INTO CREATE_VIEW_STRESS_V1 VALUES(42, 52, 'S042');
SUCCESS
INSERT INTO CREATE_VIEW_STRESS_V1 VALUES(43, 52, 'S043');
SUCCESS
INSERT INTO CREATE_VIEW_STRESS_V1 VALUES(44, 52, 'S044');
SUCCESS
INSERT INTO CREATE_VIEW_STRESS_V1 VALUES(45, 52, 'S045');
SUCCESS
INSERT INTO CREATE_VIEW_STRESS_V1 VALUES(46, 52, 'S046');
SUCCESS
INSERT INTO CREATE_VIEW_STRESS_V1 VALUES(47, 52, 'S047');
SUCCESS
INSERT INTO CREATE_VIEW_STRESS_V1 VALUES(48, 52, 'S048');
SUCCESS
INSERT INTO CREATE_VIEW_STRESS_V1 VALUES(49, 52, 'S049');
SUCCESS
INSERT INTO CREATE_VIEW_STRESS_V1 VALUES(50, 52, 'S050');
SUCCESS
INSERT INTO CREATE_VIEW_STRESS_V1 VALUES(51, 52, 'S051');
SUCCESS
INSERT INTO CREATE_VIEW_STRESS_V1 VALUES(52, 52, 'S052');
SUCCESS
INSERT INTO CREATE_VIEW_STRESS_V1 VALUES(53, 52, 'S053');
SUCCESS
INSERT INTO CREATE_VIEW_STRESS_V1 VALUES(54, 52, 'S054');
SUCCESS
INSERT INTO CREATE_VIEW_STRESS_V1 VALUES(55, 52, 'S055');
SUCCESS
INSERT INTO CREATE_VIEW_STRESS_V1 VALUES(56, 52, 'S056');
SUCCESS
INSERT INTO CREATE_VIEW_STRESS_V1 VALUES(57, 52, 'S057');
SUCCESS
INSERT INTO CREATE_VIEW_STRESS_V1 VALUES(58, 52, 'S058');
SUCCESS
INSERT INTO CREATE_VIEW_STRESS_V1 VALUES(59, 52, 'S059');
SUCCESS
INSERT INTO CREATE_VIEW_STRESS_V1 VALUES(60, 52, 'S060');
SUCCESS
INSERT INTO CREATE_VIEW_STRESS_V1 VALUES(61, 52, 'S061');
SUCCESS
INSERT INTO CREATE_VIEW_STRESS_V1 VALUES(62, 52, 'S062');
SUCCESS
INSERT INTO CREATE_VIEW_STRESS_V1 VALUES(63, 52, 'S063');
SUCCESS
INSERT INTO CREATE_VIEW_STRESS_V1 VALUES(64, 52, 'S064');
SUCCESS
INSERT INTO CREATE_VIEW_STRESS_V1 VALUES(65, 52, 'S065');
SUCCESS
INSERT INTO CREATE_VIEW_STRESS_V1 VALUES(66, 52, 'S066');
SUCCESS
INSERT INTO CREATE_VIEW_STRESS_V1 VALUES(67, 52, 'S067');
SUCCESS
INSERT INTO CREATE_VIEW_STRESS_V1 VALUES(68, 52, 'S068');
SUCCESS
INSERT INTO CREATE_VIEW_STRESS_V1 VALUES(69, 52, 'S069');
SUCCESS
INSERT INTO CREATE_VIEW_STRESS_V1 VALUES(70, 52, 'S070');
SUCCESS
INSERT INTO CREATE_VIEW_STRESS_V1 VALUES(71, 52, 'S071');
SUCCESS
INSERT INTO CREATE_VIEW_STRESS_V1 VALUES(72, 52, 'S072');
SUCCESS
INSERT INTO CREATE_VIEW_STRESS_V1 VALUES(73, 52, 'S073');
SUCCESS
INSERT INTO CREATE_VIEW_STRESS_V1 VALUES(74, 52, 'S074');
SUCCESS
INSERT INTO CREATE_VIEW_STRESS_V1 VALUES(75, 52, 'S075');
SUCCESS
INSERT INTO CREATE_VIEW_STRESS_V1 VALUES(76, 52, 'S076');
SUCCESS
INSERT INTO CREATE_VIEW_STRESS_V1 VALUES(77, 52, 'S077');
SUCCESS
INSERT INTO CREATE_VIEW_STRESS_V1 VALUES(78, 52, 'S078');
SUCCESS
INSERT INTO CREATE_VIEW_STRESS_V1 VALUES(79, 52, 'S079');
SUCCESS
INSERT INTO CREATE_VIEW_STRESS_V1 VALUES(80, 52, 'S080');
SUCCESS
INSERT INTO CREATE_VIEW_STRESS_V1 VALUES(81, 52, 'S081');
SUCCESS
INSERT INTO CREATE_VIEW_STRESS_V1 VALUES(82, 52, 'S082');
SUCCESS
INSERT INTO CREATE_VIEW_STRESS_V1 VALUES(83, 52, 'S083');
SUCCESS
INSERT INTO CREATE_VIEW_STRESS_V1 VALUES(84, 52, 'S084');
SUCCESS
INSERT INTO CREATE_VIEW_STRESS_V1 VALUES(85, 52, 'S085');
SUCCESS
INSERT INTO CREATE_VIEW_STRESS_V1 VALUES(86, 52, 'S086');
SUCCESS
INSERT INTO CREATE_VIEW_STRESS_V1 VALUES(87, 52, 'S087');
SUCCESS
INSERT INTO CREATE_VIEW_STRESS_V1 VALUES(88, 52, 'S088');
SUCCESS
INSERT INTO CREATE_VIEW_STRESS_V1 VALUES(89, 52, 'S089');
SUCCESS
INSERT INTO CREATE_VIEW_STRESS_V1 VALUES(90, 52, 'S090');
SUCCESS
INSERT INTO CREATE_VIEW_STRESS_V1 VALUES(91, 52, 'S091');
SUCCESS
INSERT INTO CREATE_VIEW_STRESS_V1 VALUES(92, 52, 'S092');
SUCCESS
INSERT INTO CREATE_VIEW_STRESS_V1 VALUES(93, 52, 'S093');
SUCCESS
INSERT INTO CREATE_VIEW_STRESS_V1 VALUES(94, 52, 'S094');
SUCCESS
INSERT INTO CREATE_VIEW_STRESS_V1 VALUES(95, 52, 'S095');
SUCCESS
INSERT INTO CREATE_VIEW_STRESS_V1 VALUES(96, 52, 'S096');
SUCCESS
INSERT INTO CREATE_VIEW_STRESS_V1 VALUES(97, 52, 'S097');
SUCCESS
INSERT INTO CREATE_VIEW_STRESS_V1 VALUES(98, 52, 'S098');
SUCCESS
INSERT INTO CREATE_VIEW_STRESS_V1 VALUES(99, 52, 'S099');
SUCCESS
INSERT INTO CREATE_VIEW_STRESS_V1 VALUES(100, 52, 'S100');
SUCCESS
INSERT INTO CREATE_VIEW_STRESS_V1 VALUES(101, 52, 'S101');
SUCCESS
INSERT INTO CREATE_VIEW_STRESS_V1 VALUES(102, 52, 'S102');
SUCCESS
INSERT INTO CREATE_VIEW_STRESS_V1 VALUES(103, 52, 'S103');
SUCCESS
INSERT INTO CREATE_VIEW_STRESS_V1 VALUES(104, 52, 'S104');
SUCCESS
INSERT INTO CREATE_VIEW_STRESS_V1 VALUES(105, 52, 'S105');
SUCCESS
INSERT INTO CREATE_VIEW_STRESS_V1 VALUES(106, 52, 'S106');
SUCCESS
INSERT INTO CREATE_VIEW_STRESS_V1 VALUES(107, 52, 'S107');
SUCCESS
INSERT INTO CREATE_VIEW_STRESS_V1 VALUES(108, 52, 'S108');
SUCCESS
INSERT INTO CREATE_VIEW_STRESS_V1 VALUES(109, 52, 'S109');
SUCCESS
INSERT INTO CREATE_VIEW_STRESS_V1 VALUES(110, 52, 'S110');
SUCCESS
INSERT INTO CREATE_VIEW_STRESS_V1 VALUES(111, 52, 'S111');
SUCCESS
INSERT INTO CREATE_VIEW_STRESS_V1 VALUES(112, 52, 'S112');
SUCCESS
INSERT INTO CREATE_VIEW_STRESS_V1 VALUES(113, 52, 'S113');
SUCCESS
INSERT INTO CREATE_VIEW_STRESS_V1 VALUES(114, 52, 'S114');
SUCCESS
INSERT INTO CREATE_VIEW_STRESS_V1 VALUES(115, 52, 'S115');
SUCCESS
INSERT INTO CREATE_VIEW_STRESS_V1 VALUES(116, 52, 'S116');
SUCCESS
INSERT INTO CREATE_VIEW_STRESS_V1 VALUES(117, 52, 'S117');
SUCCESS
INSERT INTO CREATE_VIEW_STRESS_V1 VALUES(118, 52, 'S118');
SUCCESS
INSERT INTO CREATE_VIEW_STRESS_V1 VALUES(119, 52, 'S119');
SUCCESS
INSERT INTO CREATE_VIEW_STRESS_V1 VALUES(120, 52, 'S120');
SUCCESS
INSERT INTO CREATE_VIEW_STRESS_V1 VALUES(121, 52, 'S121');
SUCCESS
INSERT INTO CREATE_VIEW_STRESS_V1 VALUES(122, 52, 'S122');
SUCCESS
INSERT INTO CREATE_VIEW_STRESS_V1 VALUES(123, 52, 'S123');
SUCCESS
INSERT INTO CREATE_VIEW_STRESS_V1 VALUES(124, 52, 'S124');
SUCCESS
INSERT INTO CREATE_VIEW_STRESS_V1 VALUES(125, 52, 'S125');
SUCCESS
INSERT INTO CREATE_VIEW_STRESS_V1 VALUES(126, 52, 'S126');
SUCCESS
INSERT INTO CREATE_VIEW_STRESS_V1 VALUES(127, 52, 'S127');
SUCCESS
INSERT INTO CREATE_VIEW_STRESS_V1 VALUES(128, 52, 'S128');
SUCCESS
INSERT INTO CREATE_VIEW_STRESS_V1 VALUES(129, 52, 'S129');
SUCCESS
INSERT INTO CREATE_VIEW_STRESS_V1 VALUES(130, 52, 'S130');
SUCCESS
INSERT INTO CREATE_VIEW_STRESS_V1 VALUES(131, 52, 'S131');
SUCCESS
INSERT INTO CREATE_VIEW_STRESS_V1 VALUES(132, 52, 'S132');
SUCCESS
INSERT INTO CREATE_VIEW_STRESS_V1 VALUES(133, 52, 'S133');
SUCCESS
INSERT INTO CREATE_VIEW_STRESS_V1 VALUES(134, 52, 'S134');
SUCCESS
INSERT INTO CREATE_VIEW_STRESS_V1 VALUES(135, 52, 'S135');
SUCCESS
INSERT INTO CREATE_VIEW_STRESS_V1 VALUES(136, 52, 'S136');
SUCCESS
INSERT INTO CREATE_VIEW_STRESS_V1 VALUES(137, 52, 'S137');
SUCCESS
INSERT INTO CREATE_VIEW_STRESS_V1 VALUES(138, 52, 'S138');
SUCCESS
INSERT INTO CREATE_VIEW_STRESS_V1 VALUES(139, 52, 'S139');
SUCCESS
INSERT INTO CREATE_VIEW_STRESS_V1 VALUES(140, 52, 'S140');
SUCCESS
INSERT INTO CREATE_VIEW_STRESS_V1 VALUES(141, 52, 'S141');
SUCCESS
INSERT INTO CREATE_VIEW_STRESS_V1 VALUES(142, 52, 'S142');
SUCCESS
INSERT INTO CREATE_VIEW_STRESS_V1 VALUES(143, 52, 'S143');
SUCCESS
INSERT INTO CREATE_VIEW_STRESS_V1 VALUES(144, 52, 'S144');
SUCCESS
INSERT INTO CREATE_VIEW_STRESS_V1 VALUES(145, 52, 'S145');
SUCCESS
INSERT INTO CREATE_VIEW_STRESS_V1 VALUES(146, 52, 'S146');
SUCCESS
INSERT INTO CREATE_VIEW_STRESS_V1 VALUES(147, 52, 'S147');
SUCCESS
INSERT INTO CREATE_VIEW_STRESS_V1 VALUES(148, 52, 'S148');
SUCCESS
INSERT INTO CREATE_VIEW_STRESS_V1 VALUES(149, 52, 'S149');
SUCCESS
INSERT INTO CREATE_VIEW_STRESS_V1 VALUES(150, 52, 'S150');
SUCCESS
INSERT INTO CREATE_VIEW_STRESS_V1 VALUES(151, 52, 'S151');
SUCCESS
INSERT INTO CREATE_VIEW_STRESS_V1 VALUES(152, 52, 'S152');
SUCCESS
INSERT INTO CREATE_VIEW_STRESS_V1 VALUES(153, 52, 'S153');
SUCCESS
INSERT INTO CREATE_VIEW_STRESS_V1 VALUES(154, 52, 'S154');
SUCCESS
INSERT INTO CREATE_VIEW_STRESS_V1 VALUES(155, 52, 'S155');
SUCCESS
INSERT INTO CREATE_VIEW_STRESS_V1 VALUES(156, 52, 'S156');
SUCCESS
INSERT INTO CREATE_VIEW_STRESS_V1 VALUES(157, 52, 'S157');
SUCCESS
INSERT INTO CREATE_VIEW_STRESS_V1 VALUES(158, 52, 'S158');
SUCCESS
INSERT INTO CREATE_VIEW_STRESS_V1 VALUES(159, 52, 'S159');
SUCCESS
INSERT INTO CREATE_VIEW_STRESS_V1 VALUES(160, 52, 'S160');
SUCCESS
INSERT INTO CREATE_VIEW_STRESS_V1 VALUES(161, 52, 'S161');
SUCCESS
INSERT INTO CREATE_VIEW_STRESS_V1 VALUES(162, 52, 'S162');
SUCCESS
INSERT INTO CREATE_VIEW_STRESS_V1 VALUES(163, 52, 'S163');
SUCCESS
INSERT INTO CREATE_VIEW_STRESS_V1 VALUES(164, 52, 'S164');
SUCCESS
INSERT INTO CREATE_VIEW_STRESS_V1 VALUES(165, 52, 'S165');
SUCCESS
INSERT INTO CREATE_VIEW_STRESS_V1 VALUES(166, 52, 'S166');
SUCCESS
INSERT INTO CREATE_VIEW_STRESS_V1 VALUES(167, 52, 'S167');
SUCCESS
INSERT INTO CREATE_VIEW_STRESS_V1 VALUES(168, 52, 'S168');
SUCCESS
INSERT INTO CREATE_VIEW_STRESS_V1 VALUES(169, 52, 'S169');
SUCCESS
INSERT INTO CREATE_VIEW_STRESS_V1 VALUES(170, 52, 'S170');
SUCCESS
INSERT INTO CREATE_VIEW_STRESS_V1 VALUES(171, 52, 'S171');
SUCCESS
INSERT INTO CREATE_VIEW_STRESS_V1 VALUES(172, 52, 'S172');
SUCCESS
INSERT INTO CREATE_VIEW_STRESS_V1 VALUES(173, 52, 'S173');
SUCCESS
INSERT INTO CREATE_VIEW_STRESS_V1 VALUES(174, 52, 'S174');
SUCCESS
INSERT INTO CREATE_VIEW_STRESS_V1 VALUES(175, 52, 'S175');
SUCCESS
INSERT INTO CREATE_VIEW_STRESS_V1 VALUES(176, 52, 'S176');
SUCCESS
INSERT INTO CREATE_VIEW_STRESS_V1 VALUES(177, 52, 'S177');
SUCCESS
INSERT INTO CREATE_VIEW_STRESS_V1 VALUES(178, 52, 'S178');
SUCCESS
INSERT INTO CREATE_VIEW_STRESS_V1 VALUES(179, 52, 'S179');
SUCCESS
INSERT INTO CREATE_VIEW_STRESS_V1 VALUES(180, 52, 'S180');
SUCCESS
INSERT INTO CREATE_VIEW_STRESS_V1 VALUES(181, 52, 'S181');
SUCCESS
INSERT INTO CREATE_VIEW_STRESS_V1 VALUES(182, 52, 'S182');
SUCCESS
INSERT INTO CREATE_VIEW_STRESS_V1 VALUES(183, 52, 'S183');
SUCCESS
INSERT INTO CREATE_VIEW_STRESS_V1 VALUES(184, 52, 'S184');
SUCCESS
INSERT INTO CREATE_VIEW_STRESS_V1 VALUES(185, 52, 'S185');
SUCCESS
INSERT INTO CREATE_VIEW_STRESS_V1 VALUES(186, 52, 'S186');
SUCCESS
INSERT INTO CREATE_VIEW_STRESS_V1 VALUES(187, 52, 'S187');
SUCCESS
INSERT INTO CREATE_VIEW_STRESS_V1 VALUES(188, 52, 'S188');
SUCCESS
INSERT INTO CREATE_VIEW_STRESS_V1 VALUES(189, 52, 'S189');
SUCCESS
INSERT INTO CREATE_VIEW_STRESS_V1 VALUES(190, 52, 'S190');
SUCCESS
INSERT INTO CREATE_VIEW_STRESS_V1 VALUES(191, 52, 'S191');
SUCCESS
INSERT INTO CREATE_VIEW_STRESS_V1 VALUES(192, 52, 'S192');
SUCCESS
INSERT INTO CREATE_VIEW_STRESS_V1 VALUES(193, 52, 'S193');
SUCCESS
INSERT INTO CREATE_VIEW_STRESS_V1 VALUES(194, 52, 'S194');
SUCCESS
INSERT INTO CREATE_VIEW_STRESS_V1 VALUES(195, 52, 'S195');
SUCCESS
INSERT INTO CREATE_VIEW_STRESS_V1 VALUES(196, 52, 'S196');
SUCCESS
INSERT INTO CREATE_VIEW_STRESS_V1 VALUES(197, 52, 'S197');
SUCCESS
INSERT INTO CREATE_VIEW_STRESS_V1 VALUES(198, 52, 'S198');
SUCCESS
INSERT INTO CREATE_VIEW_STRESS_V1 VALUES(199, 52, 'S199');
SUCCESS
INSERT INTO CREATE_VIEW_STRESS_V1 VALUES(200, 52, 'S200');
SUCCESS
INSERT INTO CREATE_VIEW_STRESS_V1 VALUES(201, 52, 'S201');
SUCCESS
INSERT INTO CREATE_VIEW_STRESS_V1 VALUES(202, 52, 'S202');
SUCCESS
INSERT INTO CREATE_VIEW_STRESS_V1 VALUES(203, 52, 'S203');
SUCCESS
INSERT INTO CREATE_VIEW_STRESS_V1 VALUES(204, 52, 'S204');
SUCCESS
INSERT INTO CREATE_VIEW_STRESS_V1 VALUES(205, 52, 'S205');
SUCCESS
INSERT INTO CREATE_VIEW_STRESS_V1 VALUES(206, 52, 'S206');
SUCCESS
INSERT INTO CREATE_VIEW_STRESS_V1 VALUES(207, 52, 'S207');
SUCCESS
INSERT INTO CREATE_VIEW_STRESS_V1 VALUES(208, 52, 'S208');
SUCCESS
INSERT INTO CREATE_VIEW_STRESS_V1 VALUES(209, 52, 'S209');
SUCCESS
INSERT INTO CREATE_VIEW_STRESS_V1 VALUES(210, 52, 'S210');
SUCCESS
INSERT INTO CREATE_VIEW_STRESS_V1 VALUES(211, 52, 'S211');
SUCCESS
INSERT INTO CREATE_VIEW_STRESS_V1 VALUES(212, 52, 'S212');
SUCCESS
INSERT INTO CREATE_VIEW_STRESS_V1 VALUES(213, 52, 'S213');
SUCCESS
INSERT INTO CREATE_VIEW_STRESS_V1 VALUES(214, 52, 'S214');
SUCCESS
INSERT INTO CREATE_VIEW_STRESS_V1 VALUES(215, 52, 'S215');
SUCCESS
INSERT INTO CREATE_VIEW_STRESS_V1 VALUES(216, 52, 'S216');
SUCCESS
INSERT INTO CREATE_VIEW_STRESS_V1 VALUES(217, 52, 'S217');
SUCCESS
INSERT INTO CREATE_VIEW_STRESS_V1 VALUES(218, 52, 'S218');
SUCCESS
INSERT INTO CREATE_VIEW_STRESS_V1 VALUES(219, 52, 'S219');
SUCCESS
INSERT INTO CREATE_VIEW_STRESS_V1 VALUES(220, 52, 'S220');
SUCCESS
INSERT INTO CREATE_VIEW_STRESS_V1 VALUES(221, 52, 'S221');
SUCCESS
INSERT INTO CREATE_VIEW_STRESS_V1 VALUES(222, 52, 'S222');
SUCCESS
INSERT INTO CREATE_VIEW_STRESS_V1 VALUES(223, 52, 'S223');
SUCCESS
INSERT INTO CREATE_VIEW_STRESS_V1 VALUES(224, 52, 'S224');
SUCCESS
INSERT INTO CREATE_VIEW_STRESS_V1 VALUES(225, 52, 'S225');
SUCCESS
INSERT INTO CREATE_VIEW_STRESS_V1 VALUES(226, 52, 'S226');
SUCCESS
INSERT INTO CREATE_VIEW_STRESS_V1 VALUES(227, 52, 'S227');
SUCCESS
INSERT INTO CREATE_VIEW_STRESS_V1 VALUES(228, 52, 'S228');
SUCCESS
INSERT INTO CREATE_VIEW_STRESS_V1 VALUES(229, 52, 'S229');
SUCCESS
INSERT INTO CREATE_VIEW_STRESS_V1 VALUES(230, 52, 'S230');
SUCCESS
INSERT INTO CREATE_VIEW_STRESS_V1 VALUES(231, 52, 'S231');
SUCCESS
INSERT INTO CREATE_VIEW_STRESS_V1 VALUES(232, 52, 'S232');
SUCCESS
INSERT INTO CREATE_VIEW_STRESS_V1 VALUES(233, 52, 'S233');
SUCCESS
INSERT INTO CREATE_VIEW_STRESS_V1 VALUES(234, 52, 'S234');
SUCCESS
INSERT INTO CREATE_VIEW_STRESS_V1 VALUES(235, 52, 'S235');
SUCCESS
INSERT INTO CREATE_VIEW_STRESS_V1 VALUES(236, 52, 'S236');
SUCCESS
INSERT INTO CREATE_VIEW_STRESS_V1 VALUES(237, 52, 'S237');
SUCCESS
INSERT INTO CREATE_VIEW_STRESS_V1 VALUES(238, 52, 'S238');
SUCCESS
INSERT INTO CREATE_VIEW_STRESS_V1 VALUES(239, 52, 'S239');
SUCCESS
INSERT INTO CREATE_VIEW_STRESS_V1 VALUES(240, 52, 'S240');
SUCCESS
INSERT INTO CREATE_VIEW_STRESS_V1 VALUES(241, 52, 'S241');
SUCCESS
INSERT INTO CREATE_VIEW_STRESS_V1 VALUES(242, 52, 'S242');
SUCCESS
INSERT INTO CREATE_VIEW_STRESS_V1 VALUES(243, 52, 'S243');
SUCCESS
INSERT INTO CREATE_VIEW_STRESS_V1 VALUES(244, 52, 'S244');
SUCCESS
INSERT INTO CREATE_VIEW_STRESS_V1 VALUES(245, 52, 'S245');
SUCCESS
INSERT INTO CREATE_VIEW_STRESS_V1 VALUES(246, 52, 'S246');
SUCCESS
INSERT INTO CREATE_VIEW_STRESS_V1 VALUES(247, 52, 'S247');
SUCCESS
INSERT INTO CREATE_VIEW_STRESS_V1 VALUES(248, 52, 'S248');
SUCCESS
INSERT INTO CREATE_VIEW_STRESS_V1 VALUES(249, 52, 'S249');
SUCCESS
INSERT INTO CREATE_VIEW_STRESS_V1 VALUES(250, 52, 'S250');
SUCCESS
INSERT INTO CREATE_VIEW_STRESS_V1 VALUES(251, 52, 'S251');
SUCCESS
INSERT INTO CREATE_VIEW_STRESS_V1 VALUES(252, 52, 'S252');
SUCCESS
UPDATE CREATE_VIEW_STRESS_V1 SET AGE=200 WHERE ID=251;
SUCCESS
DELETE FROM CREATE_VIEW_STRESS_V1 WHERE ID=252;
SUCCESS
SELECT COUNT(*) FROM CREATE_VIEW_STRESS_V1;
COUNT(*)
251
SELECT SUM(AGE) FROM CREATE_VIEW_STRESS_V1;
SUM(AGE)
13200
VIEW WITH ALIASES AND FILTERS
CREATE VIEW VIEW_ALIAS AS SELECT ID AS VID, NAME AS VNAME FROM VIEW_T1 WHERE AGE>=20;
SUCCESS
SELECT * FROM VIEW_ALIAS;
2 | B
3 | C
VID | VNAME
SELECT VNAME FROM VIEW_ALIAS WHERE VID=2;
VNAME
B

JOIN AND AGGREGATE VIEWS
CREATE VIEW VIEW_JOIN AS SELECT A.ID AS ID, A.AGE AS AGE, B.SCORE AS SCORE FROM VIEW_T1 AS A, VIEW_T2 AS B WHERE A.ID=B.ID;
SUCCESS
SELECT * FROM VIEW_JOIN;
1 | 10 | 100
2 | 20 | 200
ID | AGE | SCORE
INSERT INTO VIEW_JOIN(ID, AGE) VALUES(5, 50);
SUCCESS
UPDATE VIEW_JOIN SET AGE=21 WHERE ID=1;
SUCCESS

CREATE VIEW VIEW_AGG AS SELECT AGE, COUNT(*) AS CNT FROM VIEW_T1 GROUP BY AGE;
SUCCESS
SELECT * FROM VIEW_AGG;
10 | 1
20 | 1
30 | 1
AGE | CNT
INSERT INTO VIEW_AGG(AGE, CNT) VALUES(1, 1);
FAILURE

VIEW BOUNDARY ERRORS
CREATE VIEW VIEW_SIMPLE AS SELECT ID FROM VIEW_T1;
FAILURE
CREATE VIEW VIEW_BAD AS SELECT MISSING_COL FROM VIEW_T1;
FAILURE
SELECT * FROM MISSING_VIEW;
FAILURE
