OFFICIAL MINIOB2025-17-TEXT-OFFICIAL
DROP TABLE IF EXISTS T_TEXT;
FAILURE

CREATE TABLE T_TEXT( ID INT, ARTICLE TEXT );
SUCCESS


INSERT INTO T_TEXT VALUES (1, ''), (2, NULL);
SUCCESS


SELECT ID, LENGTH(ARTICLE) AS LEN FROM T_TEXT WHERE ID IN (1,2) ORDER BY ID;
ID | LEN
1 | 0
2 | NULL



UPDATE T_TEXT SET ARTICLE = 'A' WHERE ID = 1;
SUCCESS


UPDATE T_TEXT SET ARTICLE = CONCAT(ARTICLE, ARTICLE) WHERE ID = 1;
SUCCESS
UPDATE T_TEXT SET ARTICLE = CONCAT(ARTICLE, ARTICLE) WHERE ID = 1;
SUCCESS
UPDATE T_TEXT SET ARTICLE = CONCAT(ARTICLE, ARTICLE) WHERE ID = 1;
SUCCESS
UPDATE T_TEXT SET ARTICLE = CONCAT(ARTICLE, ARTICLE) WHERE ID = 1;
SUCCESS
UPDATE T_TEXT SET ARTICLE = CONCAT(ARTICLE, ARTICLE) WHERE ID = 1;
SUCCESS
UPDATE T_TEXT SET ARTICLE = CONCAT(ARTICLE, ARTICLE) WHERE ID = 1;
SUCCESS
UPDATE T_TEXT SET ARTICLE = CONCAT(ARTICLE, ARTICLE) WHERE ID = 1;
SUCCESS
UPDATE T_TEXT SET ARTICLE = CONCAT(ARTICLE, ARTICLE) WHERE ID = 1;
SUCCESS
UPDATE T_TEXT SET ARTICLE = CONCAT(ARTICLE, ARTICLE) WHERE ID = 1;
SUCCESS
UPDATE T_TEXT SET ARTICLE = CONCAT(ARTICLE, ARTICLE) WHERE ID = 1;
SUCCESS
UPDATE T_TEXT SET ARTICLE = CONCAT(ARTICLE, ARTICLE) WHERE ID = 1;
SUCCESS
UPDATE T_TEXT SET ARTICLE = CONCAT(ARTICLE, ARTICLE) WHERE ID = 1;
SUCCESS
UPDATE T_TEXT SET ARTICLE = CONCAT(ARTICLE, ARTICLE) WHERE ID = 1;
SUCCESS
UPDATE T_TEXT SET ARTICLE = CONCAT(ARTICLE, ARTICLE) WHERE ID = 1;
SUCCESS
UPDATE T_TEXT SET ARTICLE = CONCAT(ARTICLE, ARTICLE) WHERE ID = 1;
SUCCESS


SELECT LENGTH(ARTICLE) AS LEN_32768 FROM T_TEXT WHERE ID = 1;
LEN_32768
32768

UPDATE T_TEXT SET ARTICLE = CONCAT(ARTICLE, SUBSTR(ARTICLE, 1, 32767)) WHERE ID = 1;
SUCCESS

SELECT LENGTH(ARTICLE) AS LEN_65535 FROM T_TEXT WHERE ID = 1;
LEN_65535
65535

UPDATE T_TEXT SET ARTICLE = CONCAT(ARTICLE, 'X') WHERE ID = 1;
FAILURE


INSERT INTO T_TEXT VALUES (3, 'A');
SUCCESS
UPDATE T_TEXT SET ARTICLE = CONCAT(ARTICLE, ARTICLE) WHERE ID = 3;
SUCCESS
UPDATE T_TEXT SET ARTICLE = CONCAT(ARTICLE, ARTICLE) WHERE ID = 3;
SUCCESS
UPDATE T_TEXT SET ARTICLE = CONCAT(ARTICLE, ARTICLE) WHERE ID = 3;
SUCCESS
UPDATE T_TEXT SET ARTICLE = CONCAT(ARTICLE, ARTICLE) WHERE ID = 3;
SUCCESS
UPDATE T_TEXT SET ARTICLE = CONCAT(ARTICLE, ARTICLE) WHERE ID = 3;
SUCCESS
UPDATE T_TEXT SET ARTICLE = CONCAT(ARTICLE, ARTICLE) WHERE ID = 3;
SUCCESS
UPDATE T_TEXT SET ARTICLE = CONCAT(ARTICLE, ARTICLE) WHERE ID = 3;
SUCCESS
UPDATE T_TEXT SET ARTICLE = CONCAT(ARTICLE, ARTICLE) WHERE ID = 3;
SUCCESS
UPDATE T_TEXT SET ARTICLE = CONCAT(ARTICLE, ARTICLE) WHERE ID = 3;
SUCCESS
UPDATE T_TEXT SET ARTICLE = CONCAT(ARTICLE, ARTICLE) WHERE ID = 3;
SUCCESS
UPDATE T_TEXT SET ARTICLE = CONCAT(ARTICLE, ARTICLE) WHERE ID = 3;
SUCCESS
UPDATE T_TEXT SET ARTICLE = CONCAT(ARTICLE, ARTICLE) WHERE ID = 3;
SUCCESS
UPDATE T_TEXT SET ARTICLE = CONCAT(ARTICLE, ARTICLE) WHERE ID = 3;
SUCCESS
UPDATE T_TEXT SET ARTICLE = CONCAT(ARTICLE, ARTICLE) WHERE ID = 3;
SUCCESS
UPDATE T_TEXT SET ARTICLE = CONCAT(ARTICLE, ARTICLE) WHERE ID = 3;
SUCCESS
UPDATE T_TEXT SET ARTICLE = CONCAT(ARTICLE, SUBSTR(ARTICLE, 1, 32767)) WHERE ID = 3;
SUCCESS


INSERT INTO T_TEXT SELECT 4, CONCAT(ARTICLE, 'X') FROM T_TEXT WHERE ID = 3;
FAILURE


INSERT INTO T_TEXT VALUES (5, '汉');
SUCCESS

SELECT ID, LENGTH(ARTICLE) AS BYTES_LEN FROM T_TEXT WHERE ID = 5;
ID | BYTES_LEN
5 | 3


SELECT ID FROM T_TEXT WHERE ARTICLE IS NULL ORDER BY ID;
ID
2


SELECT ID FROM T_TEXT WHERE ARTICLE = '' ORDER BY ID;
ID


SELECT ID FROM T_TEXT WHERE ARTICLE LIKE 'A%' ORDER BY ID;
ID
1
3


SELECT ID, CASE WHEN ARTICLE IS NULL THEN NULL ELSE LENGTH(ARTICLE) END AS LEN_BYTES FROM T_TEXT ORDER BY ID;
FAILURE

