MINIOB2025 09 UNIQUE SETUP
CREATE TABLE UNIQUE_T(ID INT, EMAIL INT, REGION INT, TAG CHAR);
SUCCESS
CREATE UNIQUE INDEX IDX_UNIQUE_EMAIL ON UNIQUE_T(EMAIL);
SUCCESS
CREATE UNIQUE INDEX IDX_UNIQUE_REGION_TAG ON UNIQUE_T(REGION, TAG);
SUCCESS
INSERT INTO UNIQUE_T VALUES(1, 100, 1, 'A');
SUCCESS
INSERT INTO UNIQUE_T VALUES(2, 200, 1, 'B');
SUCCESS

UNIQUE CHECKS
INSERT INTO UNIQUE_T VALUES(3, 300, 2, 'A');
SUCCESS
SELECT ID, EMAIL, REGION, TAG FROM UNIQUE_T;
1 | 100 | 1 | A
2 | 200 | 1 | B
3 | 300 | 2 | A
ID | EMAIL | REGION | TAG
INSERT INTO UNIQUE_T VALUES(4, 100, 3, 'C');
FAILURE
INSERT INTO UNIQUE_T VALUES(5, 500, 1, 'A');
FAILURE
UPDATE UNIQUE_T SET EMAIL=200 WHERE ID=3;
FAILURE
DROP INDEX IDX_UNIQUE_EMAIL ON UNIQUE_T;
SUCCESS
INSERT INTO UNIQUE_T VALUES(6, 100, 3, 'D');
SUCCESS
SELECT ID, EMAIL FROM UNIQUE_T;
1 | 100
2 | 200
3 | 300
6 | 100
ID | EMAIL

UNIQUE BOUNDARY ERRORS
DROP INDEX MISSING_UNIQUE_IDX ON UNIQUE_T;
FAILURE
CREATE UNIQUE INDEX IDX_UNIQUE_BAD ON UNIQUE_T(MISSING_COL);
FAILURE

FUSED PRIMARY UNIQUE COVERAGE
INITIALIZATION
CREATE TABLE UNIQUE_TABLE(ID INT, COL1 INT, COL2 INT);
SUCCESS
INSERT INTO UNIQUE_TABLE VALUES (1,1,1);
SUCCESS

1. UNIQUE TEST
CREATE UNIQUE INDEX INDEX_ID ON UNIQUE_TABLE(ID);
SUCCESS
INSERT INTO UNIQUE_TABLE VALUES (2,1,1);
SUCCESS
CREATE UNIQUE INDEX INDEX_ID ON UNIQUE_TABLE(ID);
FAILURE
INSERT INTO UNIQUE_TABLE VALUES (3,2,1);
SUCCESS
INSERT INTO UNIQUE_TABLE VALUES (1,2,1);
FAILURE

2. SELECT
SELECT * FROM UNIQUE_TABLE;
1 | 1 | 1
2 | 1 | 1
3 | 2 | 1
ID | COL1 | COL2
