MINIOB2025 01 BASIC SETUP
CREATE TABLE BASIC_T(ID INT, AGE INT, NAME CHAR, SCORE FLOAT);
SUCCESS
CREATE INDEX IDX_BASIC_ID ON BASIC_T(ID);
SUCCESS
INSERT INTO BASIC_T VALUES(1, 18, 'A', 1.5);
SUCCESS
INSERT INTO BASIC_T VALUES(2, 20, 'B', 2.5);
SUCCESS
INSERT INTO BASIC_T VALUES(3, 18, 'C', 3.5);
SUCCESS

BASIC SELECT INSERT DELETE
SELECT * FROM BASIC_T WHERE ID=1;
ID | AGE | NAME | SCORE
1 | 18 | A | 1.5
SELECT ID, AGE, NAME FROM BASIC_T WHERE AGE=18;
1 | 18 | A
3 | 18 | C
ID | AGE | NAME
DELETE FROM BASIC_T WHERE ID=2;
SUCCESS
SELECT * FROM BASIC_T;
1 | 18 | A | 1.5
3 | 18 | C | 3.5
ID | AGE | NAME | SCORE
INSERT INTO BASIC_T VALUES(4, 30, 'D', 4.5);
SUCCESS
SELECT ID, SCORE FROM BASIC_T;
1 | 1.5
3 | 3.5
4 | 4.5
ID | SCORE

BASIC BOUNDARY ERRORS
CREATE TABLE BASIC_T(ID INT);
FAILURE
INSERT INTO BASIC_T VALUES(5);
FAILURE
SELECT MISSING_COL FROM BASIC_T;
FAILURE
