OFFICIAL MINIOB2025-09-UNIQUE-OFFICIAL
DROP TABLE UNIQUE_TABLE2;
FAILURE
CREATE TABLE UNIQUE_TABLE2(ID1 INT, ID2 INT, COL1 INT, COL2 INT);
SUCCESS

CREATE UNIQUE INDEX INDEX_ID ON UNIQUE_TABLE2(COL1,COL2);
FAILURE

INSERT INTO UNIQUE_TABLE2 VALUES (1, 1, 1, 1);
SUCCESS
INSERT INTO UNIQUE_TABLE2 VALUES (1, 2, 1, 2);
SUCCESS

UPDATE UNIQUE_TABLE2 SET ID1=1, ID2=4 WHERE COL1=1 AND COL2=1;
SUCCESS

SELECT * FROM UNIQUE_TABLE2 ORDER BY ID1, ID2, COL1, COL2;
ID1 | ID2 | COL1 | COL2
1 | 2 | 1 | 2
1 | 4 | 1 | 1

DROP TABLE UNIQUE_TABLE2;
SUCCESS
CREATE TABLE UNIQUE_TABLE2(ID1 INT, ID2 INT, COL1 INT, COL2 INT);
SUCCESS
CREATE UNIQUE INDEX INDEX_ID2 ON UNIQUE_TABLE2(ID1,ID2);
SUCCESS
INSERT INTO UNIQUE_TABLE2 VALUES (1, 1, 1, 1);
SUCCESS
INSERT INTO UNIQUE_TABLE2 VALUES (1, 2, 1, 1);
SUCCESS
INSERT INTO UNIQUE_TABLE2 VALUES (2, 3, 1, 1);
SUCCESS
UPDATE UNIQUE_TABLE2 SET ID1=1,ID2=4 WHERE ID2=2;
SUCCESS
SELECT * FROM UNIQUE_TABLE2;
ID1 | ID2 | COL1 | COL2
1 | 1 | 1 | 1
1 | 4 | 1 | 1
2 | 3 | 1 | 1

DROP TABLE UNIQUE_TABLE4;
FAILURE

CREATE TABLE UNIQUE_TABLE4 (ID INT, NAME CHAR(4));
SUCCESS


CREATE UNIQUE INDEX UNIQUE_TABLE4_ID ON UNIQUE_TABLE4(NAME)
FAILURE
INSERT INTO UNIQUE_TABLE4 VALUES (1, 'AAAA');
SUCCESS
INSERT INTO UNIQUE_TABLE4 VALUES (2, 'BBBB');
SUCCESS
INSERT INTO UNIQUE_TABLE4 VALUES (3, 'CCCC');
SUCCESS

DROP INDEX UNIQUE_TABLE4_ID ON UNIQUE_TABLE4;
FAILURE
