MINIOB2025 CROSS TOPIC SETUP
CREATE TABLE CROSS_USER(ID INT NOT NULL, AGE INT NULL, SCORE FLOAT, BIRTHDAY DATE, NAME CHAR);
SUCCESS
CREATE TABLE CROSS_ORDER(UID INT, AMOUNT INT, NOTE CHAR);
SUCCESS
CREATE UNIQUE INDEX IDX_CROSS_USER_ID ON CROSS_USER(ID);
SUCCESS
CREATE INDEX IDX_CROSS_USER_AGE_SCORE ON CROSS_USER(AGE, SCORE);
SUCCESS
INSERT INTO CROSS_USER VALUES(1, 18, 1.5, '2020-01-01', 'A');
SUCCESS
INSERT INTO CROSS_USER VALUES(2, NULL, 2.5, '2020-02-29', 'B');
SUCCESS
INSERT INTO CROSS_USER VALUES(3, 18, 3.5, '2021-12-31', 'C');
SUCCESS
INSERT INTO CROSS_USER VALUES(4, 30, 4.5, NULL, 'D');
SUCCESS
INSERT INTO CROSS_ORDER VALUES(1, 100, 'X');
SUCCESS
INSERT INTO CROSS_ORDER VALUES(1, 200, 'Y');
SUCCESS
INSERT INTO CROSS_ORDER VALUES(3, 300, 'Z');
SUCCESS

BASIC UPDATE DATE NULL UNIQUE AND MULTI INDEX
UPDATE CROSS_USER SET SCORE=9.5 WHERE AGE IS NULL;
SUCCESS
SELECT ID, SCORE FROM CROSS_USER WHERE AGE IS NULL;
ID | SCORE
2 | 9.5
INSERT INTO CROSS_USER VALUES(1, 99, 9.9, '2022-01-01', 'DUP');
FAILURE
SELECT ID, AGE, SCORE FROM CROSS_USER WHERE AGE=18 AND SCORE>1.0;
1 | 18 | 1.5
3 | 18 | 3.5
ID | AGE | SCORE
DELETE FROM CROSS_USER WHERE BIRTHDAY IS NULL;
SUCCESS
SELECT ID, BIRTHDAY FROM CROSS_USER;
1 | 2020-01-01
2 | 2020-02-29
3 | 2021-12-31
ID | BIRTHDAY

JOINS EXPRESSIONS FUNCTIONS GROUP BY ORDER BY
SELECT U.ID, U.NAME, O.AMOUNT, U.SCORE + O.AMOUNT AS TOTAL FROM CROSS_USER AS U INNER JOIN CROSS_ORDER AS O ON U.ID=O.UID WHERE O.AMOUNT>=100 ORDER BY U.ID ASC, O.AMOUNT DESC;
1 | A | 100 | 101.5
1 | A | 200 | 201.5
3 | C | 300 | 303.5
ID | NAME | AMOUNT | TOTAL
SELECT AGE, COUNT(*), AVG(SCORE), MIN(SCORE), MAX(SCORE) FROM CROSS_USER GROUP BY AGE;
18 | 2 | 2.5 | 1.5 | 3.5
NULL | 1 | 9.5 | 9.5 | 9.5
AGE | COUNT(*) | AVG(SCORE) | MIN(SCORE) | MAX(SCORE)
SELECT ABS(-10), LENGTH('MINIOB'), ROUND(1.234, 2);
ABS(-10) | LENGTH('MINIOB') | ROUND(1.234, 2)
10 | 6 | 1.23

SIMPLE AND COMPLEX SUBQUERY
SELECT ID, NAME FROM CROSS_USER WHERE ID IN (SELECT UID FROM CROSS_ORDER WHERE AMOUNT>150);
1 | A
3 | C
ID | NAME
SELECT ID, NAME FROM CROSS_USER WHERE EXISTS (SELECT UID FROM CROSS_ORDER WHERE CROSS_ORDER.UID=CROSS_USER.ID AND AMOUNT>150);
1 | A
3 | C
ID | NAME

DROP TABLE BOUNDARY
DROP TABLE CROSS_ORDER;
SUCCESS
SELECT * FROM CROSS_ORDER;
FAILURE
