MINIOB2025 02 UPDATE SETUP
CREATE TABLE UPDATE_T(ID INT, AGE INT, SCORE FLOAT, TAG CHAR);
SUCCESS
CREATE INDEX IDX_UPDATE_ID ON UPDATE_T(ID);
SUCCESS
CREATE INDEX IDX_UPDATE_AGE ON UPDATE_T(AGE);
SUCCESS
INSERT INTO UPDATE_T VALUES(1, 10, 1.5, 'A');
SUCCESS
INSERT INTO UPDATE_T VALUES(2, 20, 2.5, 'B');
SUCCESS
INSERT INTO UPDATE_T VALUES(3, 20, 3.5, 'C');
SUCCESS

UPDATE CHECKS
UPDATE UPDATE_T SET SCORE=9.5 WHERE ID=1;
SUCCESS
SELECT ID, SCORE FROM UPDATE_T WHERE ID=1;
ID | SCORE
1 | 9.5
UPDATE UPDATE_T SET AGE=30 WHERE AGE=20;
SUCCESS
SELECT ID, AGE FROM UPDATE_T;
1 | 10
2 | 30
3 | 30
ID | AGE
UPDATE UPDATE_T SET TAG='Z';
SUCCESS
SELECT ID, TAG FROM UPDATE_T;
1 | Z
2 | Z
3 | Z
ID | TAG

UPDATE BOUNDARY ERRORS
UPDATE UPDATE_T SET MISSING_COL=1 WHERE ID=1;
FAILURE
UPDATE MISSING_UPDATE_T SET AGE=1 WHERE ID=1;
FAILURE
UPDATE UPDATE_T SET AGE='BAD' WHERE ID=1;
FAILURE
