OFFICIAL MINIOB2025-21-COMPLEX-SUB-QUERY-OFFICIAL

DROP TABLE IF EXISTS CSQ_1;
FAILURE
DROP TABLE IF EXISTS CSQ_2;
FAILURE
DROP TABLE IF EXISTS CSQ_3;
FAILURE

CREATE TABLE CSQ_1(ID INT, COL1 INT, FEAT1 FLOAT);
SUCCESS
CREATE TABLE CSQ_2(ID INT, COL2 INT, FEAT2 FLOAT);
SUCCESS
CREATE TABLE CSQ_3(ID INT, COL3 INT, FEAT3 FLOAT);
SUCCESS

INSERT INTO CSQ_1 VALUES (14, 98, 77.00), (16, 44, 34.11), (18, 3, 3.11), (37, 23, 79.23), (45, 49, 1.70), (47, 91, 85.72), (58, 39, 27.29), ( 6, 19, 28.89), (60, 28, 10.92), (94, 96, 1.75);
SUCCESS


INSERT INTO CSQ_3 VALUES (2,0,0.0),(3,0,0.0),(4,0,0.0),(5,0,0.0),(6,0,0.0),(7,0,0.0),(8,0,0.0);
SUCCESS

INSERT INTO CSQ_2 VALUES (101, 44, 0.0), (102, 39, 0.0), (2, 98, 0.0), (3, 3, 0.0), (4, 23, 0.0), (5, 49, 0.0), (6, 91, 0.0), (7, 19, 0.0), (8, 28, 0.0), (3, 96, 0.0);
SUCCESS

SELECT * FROM CSQ_1 WHERE COL1 NOT IN (SELECT CSQ_2.COL2 FROM CSQ_2 WHERE CSQ_2.ID NOT IN (SELECT CSQ_3.ID FROM CSQ_3)) ORDER BY ID;
ID | COL1 | FEAT1
6 | 19 | 28.89
14 | 98 | 77
18 | 3 | 3.11
37 | 23 | 79.23
45 | 49 | 1.7
47 | 91 | 85.72
60 | 28 | 10.92
94 | 96 | 1.75



DROP TABLE IF EXISTS CSQ_1;
FAILURE
DROP TABLE IF EXISTS CSQ_2;
FAILURE
DROP TABLE IF EXISTS CSQ_3;
FAILURE


DELETE FROM CSQ_3 WHERE ID IS NULL;
SUCCESS

DELETE FROM CSQ_3 WHERE ID = 11;
SUCCESS

INSERT INTO CSQ_1 VALUES (11, 87, 73.07);
SUCCESS

INSERT INTO CSQ_2 VALUES (11, 0, 0.0);
SUCCESS

SELECT * FROM CSQ_1 WHERE ID IN (SELECT CSQ_2.ID FROM CSQ_2 WHERE CSQ_2.ID NOT IN (SELECT CSQ_3.ID FROM CSQ_3)) ORDER BY ID;
ID | COL1 | FEAT1
11 | 87 | 73.07


DROP TABLE IF EXISTS CSQ_1;
FAILURE
DROP TABLE IF EXISTS CSQ_2;
FAILURE
DROP TABLE IF EXISTS CSQ_3;
FAILURE

CREATE TABLE CSQ_1(ID INT, COL1 INT, FEAT1 FLOAT);
FAILURE
CREATE TABLE CSQ_2(ID INT, COL2 INT, FEAT2 FLOAT);
FAILURE
CREATE TABLE CSQ_3(ID INT, COL3 INT, FEAT3 FLOAT);
FAILURE

INSERT INTO CSQ_1 VALUES (26, 85, 34.07), (36, 96, 86.14), (88, 11, 65.45), (12, 80, 1.20), (13, 79, 3.30), (14, 60, 2.20);
SUCCESS

INSERT INTO CSQ_3 VALUES (1, 0, 5.0), (2, 0, 12.3);
SUCCESS

INSERT INTO CSQ_2 VALUES (1, 50, 7.0), (2, 80, 5.0), (3, 40, 4.0);
SUCCESS

SELECT * FROM CSQ_1 WHERE COL1 > (SELECT MAX(CSQ_2.COL2) FROM CSQ_2 WHERE CSQ_2.FEAT2 >= (SELECT MIN(CSQ_3.FEAT3) FROM CSQ_3)) ORDER BY ID;
ID | COL1 | FEAT1


DROP TABLE IF EXISTS CSQ_1;
FAILURE
DROP TABLE IF EXISTS CSQ_2;
FAILURE
DROP TABLE IF EXISTS CSQ_3;
FAILURE

CREATE TABLE CSQ_1(ID INT, COL1 INT, FEAT1 FLOAT);
FAILURE
CREATE TABLE CSQ_2(ID INT, COL2 INT, FEAT2 FLOAT);
FAILURE
CREATE TABLE CSQ_3(ID INT, COL3 INT, FEAT3 FLOAT);
FAILURE

INSERT INTO CSQ_1 VALUES (36, 69, 16.72), (71, 78, 6.07), (77, 12, 23.98);
SUCCESS

INSERT INTO CSQ_2 VALUES (1, 10, 0.0), (2, 50, 1.0);
SUCCESS

INSERT INTO CSQ_3 VALUES (1, 11, 0.0), (2, 60, 1.0);
SUCCESS

SELECT * FROM CSQ_1 WHERE (SELECT MIN(CSQ_2.COL2) FROM CSQ_2) <> (SELECT MIN(CSQ_3.COL3) FROM CSQ_3) ORDER BY ID;
FAILURE



DROP TABLE IF EXISTS CSQ_1;
FAILURE
DROP TABLE IF EXISTS CSQ_2;
FAILURE
DROP TABLE IF EXISTS CSQ_3;
FAILURE

CREATE TABLE CSQ_1(ID INT, COL1 INT, FEAT1 FLOAT);
FAILURE
CREATE TABLE CSQ_2(ID INT, COL2 INT, FEAT2 FLOAT);
FAILURE
CREATE TABLE CSQ_3(ID INT, COL3 INT, FEAT3 FLOAT);
FAILURE

INSERT INTO CSQ_1 VALUES (57, 77, 4.65), (60, 63, 66.36), (77, 27, 46.27), (79, 62, 58.94), (98, 70, 42.46);
SUCCESS

INSERT INTO CSQ_2 VALUES (1, 0, 5.00), (2, 0, 45.00), (3, 0, 47.00), (4, 0, 60.00), (5, 0, 70.00);
SUCCESS

SELECT * FROM CSQ_1 WHERE FEAT1 <> (SELECT MIN(CSQ_2.FEAT2) FROM CSQ_2 WHERE CSQ_2.FEAT2 > CSQ_1.FEAT1) ORDER BY ID;
ID | COL1 | FEAT1
6 | 19 | 28.89
12 | 80 | 1.2
13 | 79 | 3.3
14 | 60 | 2.2
16 | 44 | 34.11
18 | 3 | 3.11
26 | 85 | 34.07
36 | 69 | 16.72
45 | 49 | 1.7
57 | 77 | 4.65
58 | 39 | 27.29
60 | 28 | 10.92
60 | 63 | 66.36
71 | 78 | 6.07
77 | 12 | 23.98
77 | 27 | 46.27
79 | 62 | 58.94
88 | 11 | 65.45
94 | 96 | 1.75
98 | 70 | 42.46

