MINIOB2025 UPDATE MVCC SETUP
CREATE TABLE MVCC_UPDATE_T(ID INT, VALUE INT, NOTE CHAR);
SUCCESS
CREATE INDEX IDX_MVCC_UPDATE_ID ON MVCC_UPDATE_T(ID);
SUCCESS
INSERT INTO MVCC_UPDATE_T VALUES(1, 10, 'A');
SUCCESS
INSERT INTO MVCC_UPDATE_T VALUES(2, 20, 'B');
SUCCESS
INSERT INTO MVCC_UPDATE_T VALUES(3, 30, 'C');
SUCCESS

SINGLE CONNECTION UPDATE VISIBILITY
BEGIN;
SUCCESS
UPDATE MVCC_UPDATE_T SET VALUE=11 WHERE ID=1;
SUCCESS
SELECT VALUE FROM MVCC_UPDATE_T WHERE ID=1;
VALUE
11
COMMIT;
SUCCESS
SELECT VALUE FROM MVCC_UPDATE_T WHERE ID=1;
VALUE
11

ROLLBACK UPDATE
BEGIN;
SUCCESS
UPDATE MVCC_UPDATE_T SET VALUE=99 WHERE ID=2;
SUCCESS
SELECT VALUE FROM MVCC_UPDATE_T WHERE ID=2;
VALUE
99
ROLLBACK;
SUCCESS
SELECT VALUE FROM MVCC_UPDATE_T WHERE ID=2;
VALUE
20

MULTI CONNECTION SERIAL VISIBILITY
BEGIN;
SUCCESS
UPDATE MVCC_UPDATE_T SET NOTE='X' WHERE ID=3;
SUCCESS
SELECT NOTE FROM MVCC_UPDATE_T WHERE ID=3;
NOTE
X
SELECT NOTE FROM MVCC_UPDATE_T WHERE ID=3;
NOTE
C
COMMIT;
SUCCESS
SELECT NOTE FROM MVCC_UPDATE_T WHERE ID=3;
NOTE
X

INDEXED COLUMN UPDATE UNDER MVCC
BEGIN;
SUCCESS
UPDATE MVCC_UPDATE_T SET ID=4 WHERE VALUE=20;
SUCCESS
COMMIT;
SUCCESS
SELECT * FROM MVCC_UPDATE_T;
1 | 11 | A
3 | 30 | X
4 | 20 | B
ID | VALUE | NOTE
SELECT * FROM MVCC_UPDATE_T WHERE ID=4;
ID | VALUE | NOTE
4 | 20 | B

UNIQUE INDEX NON-KEY UPDATE UNDER MVCC
CREATE TABLE T_UPDATE_MVCC(ID INT, AGE INT, NAME CHAR(4));
SUCCESS
CREATE UNIQUE INDEX T_UPDATE_MVCC_ID_INDEX ON T_UPDATE_MVCC(ID);
SUCCESS
INSERT INTO T_UPDATE_MVCC VALUES(1, 1, 'A');
SUCCESS
INSERT INTO T_UPDATE_MVCC VALUES(2, 2, 'A');
SUCCESS
INSERT INTO T_UPDATE_MVCC VALUES(3, 3, 'A');
SUCCESS
INSERT INTO T_UPDATE_MVCC VALUES(4, 4, 'A');
SUCCESS
INSERT INTO T_UPDATE_MVCC VALUES(5, 5, 'A');
SUCCESS
INSERT INTO T_UPDATE_MVCC VALUES(6, 6, 'A');
SUCCESS
INSERT INTO T_UPDATE_MVCC VALUES(7, 7, 'A');
SUCCESS
INSERT INTO T_UPDATE_MVCC VALUES(8, 8, 'A');
SUCCESS
INSERT INTO T_UPDATE_MVCC VALUES(9, 9, 'A');
SUCCESS
INSERT INTO T_UPDATE_MVCC VALUES(10, 10, 'A');
SUCCESS
INSERT INTO T_UPDATE_MVCC VALUES(11, 11, 'A');
SUCCESS
INSERT INTO T_UPDATE_MVCC VALUES(12, 12, 'A');
SUCCESS
INSERT INTO T_UPDATE_MVCC VALUES(13, 13, 'A');
SUCCESS
INSERT INTO T_UPDATE_MVCC VALUES(14, 14, 'A');
SUCCESS
INSERT INTO T_UPDATE_MVCC VALUES(15, 15, 'A');
SUCCESS
INSERT INTO T_UPDATE_MVCC VALUES(16, 16, 'A');
SUCCESS
INSERT INTO T_UPDATE_MVCC VALUES(17, 17, 'A');
SUCCESS
INSERT INTO T_UPDATE_MVCC VALUES(18, 18, 'A');
SUCCESS
INSERT INTO T_UPDATE_MVCC VALUES(19, 19, 'A');
SUCCESS
INSERT INTO T_UPDATE_MVCC VALUES(20, 20, 'A');
SUCCESS
INSERT INTO T_UPDATE_MVCC VALUES(21, 21, 'A');
SUCCESS
INSERT INTO T_UPDATE_MVCC VALUES(22, 22, 'A');
SUCCESS
INSERT INTO T_UPDATE_MVCC VALUES(23, 23, 'A');
SUCCESS
INSERT INTO T_UPDATE_MVCC VALUES(24, 24, 'A');
SUCCESS
INSERT INTO T_UPDATE_MVCC VALUES(25, 25, 'A');
SUCCESS
BEGIN;
SUCCESS
UPDATE T_UPDATE_MVCC SET AGE = 446 WHERE ID = 17;
SUCCESS
SELECT AGE FROM T_UPDATE_MVCC WHERE ID = 17;
AGE
446
COMMIT;
SUCCESS
BEGIN;
SUCCESS
UPDATE T_UPDATE_MVCC SET AGE = 954 WHERE ID = 16;
SUCCESS
SELECT AGE FROM T_UPDATE_MVCC WHERE ID = 16;
AGE
954
COMMIT;
SUCCESS
SELECT AGE FROM T_UPDATE_MVCC WHERE ID = 16;
AGE
954
BEGIN;
SUCCESS
UPDATE T_UPDATE_MVCC SET AGE = 390 WHERE ID = 25;
SUCCESS
COMMIT;
SUCCESS
BEGIN;
SUCCESS
UPDATE T_UPDATE_MVCC SET AGE = 394 WHERE ID = 25;
SUCCESS
SELECT AGE FROM T_UPDATE_MVCC WHERE ID = 25;
AGE
394
COMMIT;
SUCCESS
