OFFICIAL MINIOB2025-20-UPDATE-MVCC-OFFICIAL

DROP TABLE IF EXISTS MVCC_T1;
FAILURE

CREATE TABLE MVCC_T1 ( ID INT, NAME CHAR(8), AMOUNT INT );
SUCCESS

INSERT INTO MVCC_T1 VALUES (1,'A1',10), (2,'A2',20), (3,'A3',30);
SUCCESS

SELECT * FROM MVCC_T1 ORDER BY ID;
ID | NAME | AMOUNT
1 | A1 | 10



BEGIN;
SUCCESS
SELECT ID,NAME,AMOUNT FROM MVCC_T1 ORDER BY ID;
ID | NAME | AMOUNT
1 | A1 | 10

BEGIN;
SUCCESS
UPDATE MVCC_T1 SET NAME='B2' WHERE ID=2;
SUCCESS
SELECT ID,NAME,AMOUNT FROM MVCC_T1 WHERE ID=2;
ID | NAME | AMOUNT

SELECT ID,NAME,AMOUNT FROM MVCC_T1 WHERE ID=2;
ID | NAME | AMOUNT

COMMIT;
SUCCESS

SELECT ID,NAME,AMOUNT FROM MVCC_T1 WHERE ID=2;
ID | NAME | AMOUNT

COMMIT;
SUCCESS
BEGIN;
SUCCESS
SELECT ID,NAME,AMOUNT FROM MVCC_T1 WHERE ID=2;
ID | NAME | AMOUNT
COMMIT;
SUCCESS



SELECT * FROM MVCC_T1 ORDER BY ID;
ID | NAME | AMOUNT
1 | A1 | 10

BEGIN;
SUCCESS
UPDATE MVCC_T1 SET AMOUNT=31 WHERE ID=3;
SUCCESS

BEGIN;
SUCCESS
UPDATE MVCC_T1 SET AMOUNT=35 WHERE ID=3;
SUCCESS
COMMIT;
SUCCESS

COMMIT;
SUCCESS

ROLLBACK;
SUCCESS
SELECT ID,NAME,AMOUNT FROM MVCC_T1 WHERE ID=3;
ID | NAME | AMOUNT



BEGIN;
SUCCESS
SELECT COUNT(*) FROM MVCC_T1 WHERE AMOUNT >= 20;
COUNT(*)

BEGIN;
SUCCESS
INSERT INTO MVCC_T1 VALUES (4,'D4',50);
SUCCESS
COMMIT;
SUCCESS

SELECT COUNT(*) FROM MVCC_T1 WHERE AMOUNT >= 20;
COUNT(*)
1

COMMIT;
SUCCESS
BEGIN;
SUCCESS
SELECT COUNT(*) FROM MVCC_T1 WHERE AMOUNT >= 20;
COUNT(*)
1
COMMIT;
SUCCESS



SELECT * FROM MVCC_T1 ORDER BY ID;
ID | NAME | AMOUNT
1 | A1 | 10
4 | D4 | 50

BEGIN;
SUCCESS
UPDATE MVCC_T1 SET AMOUNT = AMOUNT + 1 WHERE AMOUNT >= 20;
FAILURE

BEGIN;
SUCCESS
INSERT INTO MVCC_T1 VALUES (5,'E5',25);
SUCCESS
COMMIT;
SUCCESS

COMMIT;
SUCCESS

SELECT * FROM MVCC_T1 ORDER BY ID;
ID | NAME | AMOUNT
1 | A1 | 10
4 | D4 | 50
5 | E5 | 25
