MINIOB2025 13 NULL SETUP
CREATE TABLE NULL_T(ID INT NOT NULL, AGE INT NULL, SCORE FLOAT NULL, TAG CHAR);
SUCCESS
INSERT INTO NULL_T VALUES(1, 18, 1.5, 'A');
SUCCESS
INSERT INTO NULL_T VALUES(2, NULL, 2.5, 'B');
SUCCESS
INSERT INTO NULL_T VALUES(3, 30, NULL, NULL);
SUCCESS

NULL CHECKS
SELECT ID FROM NULL_T WHERE AGE IS NULL;
2
ID
SELECT ID FROM NULL_T WHERE SCORE IS NOT NULL;
1
2
ID
SELECT ID, AGE + 1 AS AGE_PLUS FROM NULL_T WHERE ID=2;
ID | AGE_PLUS
2 | NULL
SELECT COUNT(*), COUNT(AGE), COUNT(SCORE) FROM NULL_T;
COUNT(*) | COUNT(AGE) | COUNT(SCORE)
3 | 2 | 2
UPDATE NULL_T SET AGE=NULL WHERE ID=1;
SUCCESS
SELECT ID, AGE FROM NULL_T;
1 | NULL
2 | NULL
3 | 30
ID | AGE

NULL BOUNDARY ERRORS
INSERT INTO NULL_T VALUES(NULL, 1, 1.0, 'X');
FAILURE
SELECT ID FROM NULL_T WHERE MISSING_COL IS NULL;
FAILURE
