MINIOB2025 CREATE VIEW SETUP
CREATE TABLE VIEW_T1(ID INT, AGE INT, NAME CHAR);
SUCCESS
CREATE TABLE VIEW_T2(ID INT, SCORE INT, TAG CHAR);
SUCCESS
INSERT INTO VIEW_T1 VALUES(1, 10, 'A');
SUCCESS
INSERT INTO VIEW_T1 VALUES(2, 20, 'B');
SUCCESS
INSERT INTO VIEW_T1 VALUES(3, 30, 'C');
SUCCESS
INSERT INTO VIEW_T2 VALUES(1, 100, 'X');
SUCCESS
INSERT INTO VIEW_T2 VALUES(2, 200, 'Y');
SUCCESS

SIMPLE VIEW SELECT
CREATE VIEW VIEW_SIMPLE AS SELECT ID, AGE FROM VIEW_T1;
SUCCESS
SELECT * FROM VIEW_SIMPLE;
1 | 10
2 | 20
3 | 30
ID | AGE
INSERT INTO VIEW_SIMPLE(ID, AGE) VALUES(4, 40);
SUCCESS
SELECT * FROM VIEW_T1;
1 | 10 | A
2 | 20 | B
3 | 30 | C
4 | 40 | NULL
ID | AGE | NAME
UPDATE VIEW_SIMPLE SET AGE=41 WHERE ID=4;
SUCCESS
SELECT AGE FROM VIEW_T1 WHERE ID=4;
AGE
41
DELETE FROM VIEW_SIMPLE WHERE ID=4;
SUCCESS
SELECT * FROM VIEW_T1;
1 | 10 | A
2 | 20 | B
3 | 30 | C
ID | AGE | NAME

VIEW INSERT COUNT STAYS CURRENT
CREATE TABLE CREATE_VIEW_T1(ID INT, AGE INT, NAME CHAR(10));
SUCCESS
INSERT INTO CREATE_VIEW_T1 VALUES(10, 10, 'SEED1');
SUCCESS
INSERT INTO CREATE_VIEW_T1 VALUES(20, 20, 'SEED2');
SUCCESS
CREATE VIEW CREATE_VIEW_V1 AS SELECT * FROM CREATE_VIEW_T1;
SUCCESS
INSERT INTO CREATE_VIEW_V1 VALUES(193, 193, 'TJ4JHV');
SUCCESS
INSERT INTO CREATE_VIEW_V1 VALUES(83, 83, '2DLDAT9GLO');
SUCCESS
INSERT INTO CREATE_VIEW_V1 VALUES(177, 177, 'Q09KYCS');
SUCCESS
SELECT COUNT(*) FROM CREATE_VIEW_V1;
COUNT(*)
5
UPDATE CREATE_VIEW_V1 SET AGE=120 WHERE ID=193;
SUCCESS
DELETE FROM CREATE_VIEW_V1 WHERE ID=83;
SUCCESS
SELECT SUM(AGE) FROM CREATE_VIEW_V1;
SUM(AGE)
327

VIEW WITH ALIASES AND FILTERS
CREATE VIEW VIEW_ALIAS AS SELECT ID AS VID, NAME AS VNAME FROM VIEW_T1 WHERE AGE>=20;
SUCCESS
SELECT * FROM VIEW_ALIAS;
2 | B
3 | C
VID | VNAME
SELECT VNAME FROM VIEW_ALIAS WHERE VID=2;
VNAME
B

JOIN AND AGGREGATE VIEWS
CREATE VIEW VIEW_JOIN AS SELECT A.ID AS ID, A.AGE AS AGE, B.SCORE AS SCORE FROM VIEW_T1 AS A, VIEW_T2 AS B WHERE A.ID=B.ID;
SUCCESS
SELECT * FROM VIEW_JOIN;
1 | 10 | 100
2 | 20 | 200
ID | AGE | SCORE
INSERT INTO VIEW_JOIN(ID, AGE) VALUES(5, 50);
SUCCESS
UPDATE VIEW_JOIN SET AGE=21 WHERE ID=1;
SUCCESS

CREATE VIEW VIEW_AGG AS SELECT AGE, COUNT(*) AS CNT FROM VIEW_T1 GROUP BY AGE;
SUCCESS
SELECT * FROM VIEW_AGG;
20 | 1
21 | 1
30 | 1
50 | 1
AGE | CNT
INSERT INTO VIEW_AGG(AGE, CNT) VALUES(1, 1);
FAILURE

VIEW BOUNDARY ERRORS
CREATE VIEW VIEW_SIMPLE AS SELECT ID FROM VIEW_T1;
FAILURE
CREATE VIEW VIEW_BAD AS SELECT MISSING_COL FROM VIEW_T1;
FAILURE
SELECT * FROM MISSING_VIEW;
FAILURE
