MINIOB2025 13 NULL SETUP
CREATE TABLE NULL_T(ID INT NOT NULL, AGE INT NULL, SCORE FLOAT NULL, TAG CHAR);
SUCCESS
INSERT INTO NULL_T VALUES(1, 18, 1.5, 'A');
SUCCESS
INSERT INTO NULL_T VALUES(2, NULL, 2.5, 'B');
SUCCESS
INSERT INTO NULL_T VALUES(3, 30, NULL, NULL);
SUCCESS

NULL CHECKS
SELECT ID FROM NULL_T WHERE AGE IS NULL;
2
ID
SELECT ID FROM NULL_T WHERE SCORE IS NOT NULL;
1
2
ID
SELECT ID, AGE + 1 AS AGE_PLUS FROM NULL_T WHERE ID=2;
ID | AGE_PLUS
2 | NULL
SELECT COUNT(*), COUNT(AGE), COUNT(SCORE) FROM NULL_T;
COUNT(*) | COUNT(AGE) | COUNT(SCORE)
3 | 2 | 2
UPDATE NULL_T SET AGE=NULL WHERE ID=1;
SUCCESS
SELECT ID, AGE FROM NULL_T;
1 | NULL
2 | NULL
3 | 30
ID | AGE

NULL UPDATE ASSIGNMENT EXPRESSIONS
CREATE TABLE NULL_TABLE3(ID INT NOT NULL, NUM INT NULL);
SUCCESS
CREATE TABLE NULL_TABLE4(ID INT NOT NULL, NUM INT NULL, NAME CHAR(10) NULL);
SUCCESS
INSERT INTO NULL_TABLE3 VALUES(3, NULL);
SUCCESS
INSERT INTO NULL_TABLE3 VALUES(7, 7);
SUCCESS
INSERT INTO NULL_TABLE4 VALUES(2, 2, 'N2');
SUCCESS
INSERT INTO NULL_TABLE4 VALUES(4, 4, 'N4');
SUCCESS
INSERT INTO NULL_TABLE4 VALUES(2, 2, 'N2');
SUCCESS
UPDATE NULL_TABLE4 SET NUM=NULL WHERE ID=2;
SUCCESS
UPDATE NULL_TABLE4 SET NAME=NULL WHERE NUM IS NULL;
SUCCESS
UPDATE NULL_TABLE4 SET ID=NULL WHERE NUM IS NULL;
FAILURE
UPDATE NULL_TABLE4 SET NUM=(SELECT NULL_TABLE3.NUM FROM NULL_TABLE3 WHERE NULL_TABLE3.ID=3) WHERE ID=4;
SUCCESS
SELECT ID, NUM, NAME FROM NULL_TABLE4;
2 | NULL | NULL
2 | NULL | NULL
4 | NULL | N4
ID | NUM | NAME

NULL UPDATE-SELECT REGRESSION
CREATE TABLE NULL_TABLE7(ID INT NOT NULL, NUM INT NULL);
SUCCESS
CREATE TABLE NULL_TABLE8(ID INT NOT NULL, NUM INT NULL, NAME CHAR(10) NULL);
SUCCESS
INSERT INTO NULL_TABLE7 VALUES(3, NULL);
SUCCESS
INSERT INTO NULL_TABLE8 VALUES(2, 2, 'N2');
SUCCESS
INSERT INTO NULL_TABLE8 VALUES(7, 7, 'N7');
SUCCESS
UPDATE NULL_TABLE8 SET NUM=NULL WHERE ID=2;
SUCCESS
UPDATE NULL_TABLE8 SET NAME=NULL WHERE NUM IS NULL;
SUCCESS
UPDATE NULL_TABLE8 SET ID=NULL WHERE NUM IS NULL;
FAILURE
UPDATE NULL_TABLE8 SET NUM=(SELECT NULL_TABLE7.NUM FROM NULL_TABLE7 WHERE NULL_TABLE7.ID=3) WHERE ID=7;
SUCCESS

NULL UNIQUE UPDATE SUBQUERY REGRESSION
CREATE TABLE NULL_TABLE5(ID INT NULL, NUM INT NOT NULL);
SUCCESS
CREATE UNIQUE INDEX INDEX_ID ON NULL_TABLE5(ID);
SUCCESS
INSERT INTO NULL_TABLE5 VALUES(1,1);
SUCCESS
INSERT INTO NULL_TABLE5 VALUES(1,1);
FAILURE
INSERT INTO NULL_TABLE5 VALUES(NULL,1);
SUCCESS
CREATE TABLE NULL_TABLE6(ID1 INT NULL, ID2 INT NULL, NUM INT NOT NULL);
SUCCESS
CREATE UNIQUE INDEX INDEX_ID ON NULL_TABLE6(ID1, ID2);
SUCCESS
INSERT INTO NULL_TABLE6 VALUES(2,NULL,2);
SUCCESS
INSERT INTO NULL_TABLE6 VALUES(1,NULL,2);
SUCCESS
INSERT INTO NULL_TABLE6 VALUES(NULL,NULL,1);
SUCCESS
INSERT INTO NULL_TABLE6 VALUES(8,NULL,8);
SUCCESS
UPDATE NULL_TABLE6 SET ID1=(SELECT NULL_TABLE5.ID FROM NULL_TABLE5 WHERE NULL_TABLE5.NUM=1),ID2=4 WHERE ID1=8 AND NUM=8;
SUCCESS
SELECT * FROM NULL_TABLE6;
ID1 | ID2 | NUM
2 | NULL | 2
1 | NULL | 2
NULL | NULL | 1
1 | 4 | 8

NULL BOUNDARY ERRORS
INSERT INTO NULL_T VALUES(NULL, 1, 1.0, 'X');
FAILURE
SELECT ID FROM NULL_T WHERE MISSING_COL IS NULL;
FAILURE
