MINIOB2025 CREATE VIEW JOIN UPDATE SEMIJOIN
CREATE TABLE CREATE_VIEW_JOIN_UPDATE_T1(ID INT, AGE INT, NAME CHAR(10));
SUCCESS
CREATE TABLE CREATE_VIEW_JOIN_UPDATE_T2(ID INT, AGE INT, NAME CHAR(10));
SUCCESS
INSERT INTO CREATE_VIEW_JOIN_UPDATE_T1 VALUES(1, 10, 'A');
SUCCESS
INSERT INTO CREATE_VIEW_JOIN_UPDATE_T1 VALUES(2, 20, 'B');
SUCCESS
INSERT INTO CREATE_VIEW_JOIN_UPDATE_T2 VALUES(1, 100, 'X');
SUCCESS
CREATE VIEW CREATE_VIEW_JOIN_UPDATE_V AS SELECT T1.ID AS ID, T1.AGE AS AGE, T2.NAME AS NAME FROM CREATE_VIEW_JOIN_UPDATE_T1 T1, CREATE_VIEW_JOIN_UPDATE_T2 T2 WHERE T1.ID=T2.ID;
SUCCESS
UPDATE CREATE_VIEW_JOIN_UPDATE_V SET AGE=99 WHERE ID=2;
SUCCESS
SELECT SUM(AGE) FROM CREATE_VIEW_JOIN_UPDATE_T1;
SUM(AGE)
30
UPDATE CREATE_VIEW_JOIN_UPDATE_V SET AGE=88 WHERE ID=1;
SUCCESS
SELECT SUM(AGE) FROM CREATE_VIEW_JOIN_UPDATE_T1;
SUM(AGE)
108
INSERT INTO CREATE_VIEW_JOIN_UPDATE_V(ID, AGE) VALUES(3, 30);
SUCCESS
SELECT SUM(AGE) FROM CREATE_VIEW_JOIN_UPDATE_T1;
SUM(AGE)
138
UPDATE CREATE_VIEW_JOIN_UPDATE_V SET AGE=77 WHERE ID=3;
SUCCESS
SELECT SUM(AGE) FROM CREATE_VIEW_JOIN_UPDATE_T1;
SUM(AGE)
138
