OFFICIAL MINIOB2025-13-NULL-OFFICIAL
CREATE TABLE NULL_TABLE(ID INT NOT NULL, NUM INT NULL, PRICE FLOAT NOT NULL, BIRTHDAY DATE NULL);
SUCCESS
CREATE TABLE NULL_TABLE2(ID INT NOT NULL, NUM INT NULL, PRICE FLOAT NOT NULL, BIRTHDAY DATE NULL);
SUCCESS
CREATE INDEX INDEX_NUM ON NULL_TABLE(NUM);
SUCCESS

INSERT INTO NULL_TABLE VALUES (1, 5, 34.78, '2008-08-28');
SUCCESS
INSERT INTO NULL_TABLE VALUES (4, 7, 13.01, '2022-08-13');
SUCCESS
INSERT INTO NULL_TABLE VALUES (4, 7, 39.50, '2014-07-01');
SUCCESS
INSERT INTO NULL_TABLE VALUES (5, 15, 40.00, NULL);
SUCCESS
INSERT INTO NULL_TABLE VALUES (7, 1, 14.72, '2007-03-18');
SUCCESS
INSERT INTO NULL_TABLE VALUES (7, 1, 23.96, '2022-08-25');
SUCCESS
INSERT INTO NULL_TABLE VALUES (7, 6, 17.09, '2019-07-18');
SUCCESS
INSERT INTO NULL_TABLE VALUES (7, 7, 11.04, '2013-05-11');
SUCCESS
INSERT INTO NULL_TABLE VALUES (7, NULL, 24.41, '2012-05-21');
SUCCESS
INSERT INTO NULL_TABLE VALUES (7, 2, 24.41, '2020-11-27');
SUCCESS
INSERT INTO NULL_TABLE VALUES (8, 6, 47.90, '2008-02-17');
SUCCESS
INSERT INTO NULL_TABLE VALUES (9, NULL, 33.18, '2009-08-13');
SUCCESS

SELECT * FROM NULL_TABLE;
ID | NUM | PRICE | BIRTHDAY
1 | 5 | 34.78 | 2008-08-28
4 | 7 | 13.01 | 2022-08-13
4 | 7 | 39.5 | 2014-07-01
5 | 15 | 40 | NULL
7 | 1 | 14.72 | 2007-03-18
7 | 1 | 23.96 | 2022-08-25
7 | 6 | 17.09 | 2019-07-18
7 | 7 | 11.04 | 2013-05-11
7 | NULL | 24.41 | 2012-05-21
7 | 2 | 24.41 | 2020-11-27
8 | 6 | 47.9 | 2008-02-17
9 | NULL | 33.18 | 2009-08-13

CREATE TABLE NULL_TABLE5(ID INT NULL, NUM INT NOT NULL);
SUCCESS
CREATE UNIQUE INDEX INDEX_ID ON NULL_TABLE5(ID);
SUCCESS

INSERT INTO NULL_TABLE5 VALUES(1,1);
SUCCESS
INSERT INTO NULL_TABLE5 VALUES(1,1);
FAILURE
INSERT INTO NULL_TABLE5 VALUES(NULL,1);
SUCCESS
INSERT INTO NULL_TABLE5 VALUES(1,NULL);
FAILURE

CREATE TABLE NULL_TABLE6(ID1 INT NULL, ID2 INT NULL, NUM INT NOT NULL);
SUCCESS

CREATE UNIQUE INDEX INDEX_ID ON NULL_TABLE6(ID1,ID2);
SUCCESS

INSERT INTO NULL_TABLE6 VALUES(1,NULL,1);
SUCCESS
INSERT INTO NULL_TABLE6 VALUES(2,NULL,2);
SUCCESS
INSERT INTO NULL_TABLE6 VALUES(NULL,NULL,1);
SUCCESS
INSERT INTO NULL_TABLE6 VALUES(NULL,NULL,2);
SUCCESS

UPDATE NULL_TABLE6 SET ID1=2 WHERE ID1 IS NULL AND ID2 IS NULL;
SUCCESS

SELECT * FROM NULL_TABLE6;
ID1 | ID2 | NUM
1 | NULL | 1
2 | NULL | 2
2 | NULL | 1
2 | NULL | 2

DROP TABLE NULL_TABLE;
SUCCESS
CREATE TABLE NULL_TABLE(ID INT NOT NULL, NUM INT NULL, PRICE FLOAT NOT NULL, BIRTHDAY DATE NULL);
SUCCESS
CREATE INDEX INDEX_NUM ON NULL_TABLE(NUM);
SUCCESS
INSERT INTO NULL_TABLE VALUES (1, 5, 1.0, NULL);
SUCCESS
INSERT INTO NULL_TABLE VALUES (2, 5, 1.0, NULL);
SUCCESS
INSERT INTO NULL_TABLE VALUES (3, 5, 1.0, NULL);
SUCCESS
INSERT INTO NULL_TABLE VALUES (4, 5, 1.0, NULL);
SUCCESS
INSERT INTO NULL_TABLE VALUES (5, 5, 1.0, NULL);
SUCCESS
INSERT INTO NULL_TABLE VALUES (6, 5, 1.0, NULL);
SUCCESS
INSERT INTO NULL_TABLE VALUES (7, 5, 1.0, NULL);
SUCCESS
INSERT INTO NULL_TABLE VALUES (8, 5, 1.0, NULL);
SUCCESS
INSERT INTO NULL_TABLE VALUES (9, 5, 1.0, NULL);
SUCCESS
INSERT INTO NULL_TABLE VALUES (10, 6, 1.0, NULL);
SUCCESS
INSERT INTO NULL_TABLE VALUES (11, 6, 1.0, NULL);
SUCCESS
INSERT INTO NULL_TABLE VALUES (12, 6, 1.0, NULL);
SUCCESS
INSERT INTO NULL_TABLE VALUES (13, 6, 1.0, NULL);
SUCCESS
INSERT INTO NULL_TABLE VALUES (14, 6, 1.0, NULL);
SUCCESS
INSERT INTO NULL_TABLE VALUES (15, 6, 1.0, NULL);
SUCCESS
INSERT INTO NULL_TABLE VALUES (16, 6, 1.0, NULL);
SUCCESS
INSERT INTO NULL_TABLE VALUES (17, NULL, 1.0, NULL);
SUCCESS
SELECT AVG(NUM) FROM NULL_TABLE;
AVG(NUM)
5.44
