MINIOB2025 17 TEXT SETUP
CREATE TABLE TEXT_T(ID INT, CONTENT TEXT, TAG CHAR);
SUCCESS
INSERT INTO TEXT_T VALUES(1, 'HELLO MINIOB DATABASE', 'A');
SUCCESS
INSERT INTO TEXT_T VALUES(2, 'LONG TEXT VALUE WITH SPACES AND SYMBOLS 12345', 'B');
SUCCESS
INSERT INTO TEXT_T VALUES(3, '', 'C');
SUCCESS
INSERT INTO TEXT_T VALUES(4, NULL, 'D');
SUCCESS

TEXT CHECKS
SELECT ID, CONTENT FROM TEXT_T WHERE ID=1;
ID | CONTENT
1 | HELLO MINIOB DATABASE
SELECT ID, LENGTH(CONTENT) AS CONTENT_LEN FROM TEXT_T WHERE ID IN (2, 3, 4) ORDER BY ID;
ID | CONTENT_LEN
2 | 45
3 | 0
4 | NULL
UPDATE TEXT_T SET CONTENT='UPDATED TEXT' WHERE ID=3;
SUCCESS
SELECT CONTENT FROM TEXT_T WHERE ID=3;
CONTENT
UPDATED TEXT
SELECT ID FROM TEXT_T WHERE CONTENT='HELLO MINIOB DATABASE' OR CONTENT='';
1
ID

TEXT BOUNDARY ERRORS
INSERT INTO TEXT_T VALUES(5);
FAILURE
SELECT MISSING_COL FROM TEXT_T;
FAILURE
