MINIOB2025 04 DATE SETUP
CREATE TABLE DATE_T(ID INT, BIRTHDAY DATE, TAG CHAR);
SUCCESS
INSERT INTO DATE_T VALUES(1, '1969-12-31', 'A');
SUCCESS
INSERT INTO DATE_T VALUES(2, '1970-01-01', 'B');
SUCCESS
INSERT INTO DATE_T VALUES(3, '2038-01-20', 'C');
SUCCESS
INSERT INTO DATE_T VALUES(4, '2020-02-29', 'D');
SUCCESS

DATE CHECKS
SELECT ID, BIRTHDAY FROM DATE_T;
1 | 1969-12-31
2 | 1970-01-01
3 | 2038-01-20
4 | 2020-02-29
ID | BIRTHDAY
SELECT ID FROM DATE_T WHERE BIRTHDAY='2020-02-29';
ID
4
SELECT ID, BIRTHDAY FROM DATE_T WHERE BIRTHDAY<'1970-01-01' OR BIRTHDAY>'2038-01-19';
1 | 1969-12-31
3 | 2038-01-20
ID | BIRTHDAY
UPDATE DATE_T SET BIRTHDAY='2024-02-29' WHERE ID=2;
SUCCESS
SELECT BIRTHDAY FROM DATE_T WHERE ID=2;
BIRTHDAY
2024-02-29

DATE BOUNDARY ERRORS
INSERT INTO DATE_T VALUES(5, '2021-02-29', 'X');
FAILURE
INSERT INTO DATE_T VALUES(6, '2020-13-01', 'Y');
FAILURE
UPDATE DATE_T SET BIRTHDAY='2020-00-01' WHERE ID=1;
FAILURE
