MINIOB2025 04 DATE SETUP
CREATE TABLE DATE_T(ID INT, BIRTHDAY DATE, TAG CHAR);
SUCCESS
INSERT INTO DATE_T VALUES(1, '1969-12-31', 'A');
SUCCESS
INSERT INTO DATE_T VALUES(2, '1970-01-01', 'B');
SUCCESS
INSERT INTO DATE_T VALUES(3, '2038-01-20', 'C');
SUCCESS
INSERT INTO DATE_T VALUES(4, '2020-02-29', 'D');
SUCCESS

DATE CHECKS
SELECT ID, BIRTHDAY FROM DATE_T;
1 | 1969-12-31
2 | 1970-01-01
3 | 2038-01-20
4 | 2020-02-29
ID | BIRTHDAY
SELECT ID FROM DATE_T WHERE BIRTHDAY='2020-02-29';
ID
4
SELECT ID, BIRTHDAY FROM DATE_T WHERE BIRTHDAY<'1970-01-01' OR BIRTHDAY>'2038-01-19';
1 | 1969-12-31
3 | 2038-01-20
ID | BIRTHDAY
UPDATE DATE_T SET BIRTHDAY='2024-02-29' WHERE ID=2;
SUCCESS
SELECT BIRTHDAY FROM DATE_T WHERE ID=2;
BIRTHDAY
2024-02-29

DATE BOUNDARY ERRORS
INSERT INTO DATE_T VALUES(5, '2021-02-29', 'X');
FAILURE
INSERT INTO DATE_T VALUES(6, '2020-13-01', 'Y');
FAILURE
UPDATE DATE_T SET BIRTHDAY='2020-00-01' WHERE ID=1;
FAILURE

FUSED PRIMARY DATE COVERAGE
INITIALIZATION
CREATE TABLE DATE_TABLE(ID INT, U_DATE DATE);
SUCCESS
CREATE INDEX INDEX_ID ON DATE_TABLE(U_DATE);
SUCCESS

1. INSERT NORMAL DATE DATA
INSERT INTO DATE_TABLE VALUES (1,'2020-01-21');
SUCCESS
INSERT INTO DATE_TABLE VALUES (2,'2020-10-21');
SUCCESS
INSERT INTO DATE_TABLE VALUES (3,'2020-1-01');
SUCCESS
INSERT INTO DATE_TABLE VALUES (4,'2020-01-1');
SUCCESS
INSERT INTO DATE_TABLE VALUES (5,'2019-12-21');
SUCCESS
INSERT INTO DATE_TABLE VALUES (6,'2016-2-29');
SUCCESS
INSERT INTO DATE_TABLE VALUES (7,'1970-1-1');
SUCCESS
INSERT INTO DATE_TABLE VALUES (8,'2000-01-01');
SUCCESS
INSERT INTO DATE_TABLE VALUES (9,'2038-1-19');
SUCCESS

2. COMPARE DATE DATA
SELECT * FROM DATE_TABLE WHERE U_DATE>'2020-1-20';
1 | 2020-01-21
2 | 2020-10-21
9 | 2038-01-19
ID | U_DATE
SELECT * FROM DATE_TABLE WHERE U_DATE<'2019-12-31';
5 | 2019-12-21
6 | 2016-02-29
7 | 1970-01-01
8 | 2000-01-01
ID | U_DATE
SELECT * FROM DATE_TABLE WHERE U_DATE='2020-1-1';
3 | 2020-01-01
4 | 2020-01-01
ID | U_DATE

3. DELETE DATA
DELETE FROM DATE_TABLE WHERE U_DATE>'2012-2-29';
SUCCESS
SELECT * FROM DATE_TABLE;
7 | 1970-01-01
8 | 2000-01-01
ID | U_DATE

4. CHECK INVALID DATE DATA
SELECT * FROM DATE_TABLE WHERE U_DATE='2017-2-29';
FAILURE
SELECT * FROM DATE_TABLE WHERE U_DATE='2017-21-29';
FAILURE
SELECT * FROM DATE_TABLE WHERE U_DATE='2017-12-32';
FAILURE
SELECT * FROM DATE_TABLE WHERE U_DATE='2017-11-31';
FAILURE

INSERT INTO DATE_TABLE VALUES (10,'2017-2-29');
FAILURE
INSERT INTO DATE_TABLE VALUES (11,'2017-21-29');
FAILURE
INSERT INTO DATE_TABLE VALUES (12,'2017-12-32');
FAILURE
INSERT INTO DATE_TABLE VALUES (13,'2017-11-31');
FAILURE
