MINIOB2025 UPDATE MVCC SETUP
CREATE TABLE MVCC_UPDATE_T(ID INT, VALUE INT, NOTE CHAR);
SUCCESS
CREATE INDEX IDX_MVCC_UPDATE_ID ON MVCC_UPDATE_T(ID);
SUCCESS
INSERT INTO MVCC_UPDATE_T VALUES(1, 10, 'A');
SUCCESS
INSERT INTO MVCC_UPDATE_T VALUES(2, 20, 'B');
SUCCESS
INSERT INTO MVCC_UPDATE_T VALUES(3, 30, 'C');
SUCCESS

SINGLE CONNECTION UPDATE VISIBILITY
BEGIN;
SUCCESS
UPDATE MVCC_UPDATE_T SET VALUE=11 WHERE ID=1;
SUCCESS
SELECT VALUE FROM MVCC_UPDATE_T WHERE ID=1;
VALUE
11
COMMIT;
SUCCESS
SELECT VALUE FROM MVCC_UPDATE_T WHERE ID=1;
VALUE
11

ROLLBACK UPDATE
BEGIN;
SUCCESS
UPDATE MVCC_UPDATE_T SET VALUE=99 WHERE ID=2;
SUCCESS
SELECT VALUE FROM MVCC_UPDATE_T WHERE ID=2;
VALUE
99
ROLLBACK;
SUCCESS
SELECT VALUE FROM MVCC_UPDATE_T WHERE ID=2;
VALUE
20

MULTI CONNECTION SERIAL VISIBILITY
BEGIN;
SUCCESS
UPDATE MVCC_UPDATE_T SET NOTE='X' WHERE ID=3;
SUCCESS
SELECT NOTE FROM MVCC_UPDATE_T WHERE ID=3;
NOTE
X
SELECT NOTE FROM MVCC_UPDATE_T WHERE ID=3;
NOTE
C
COMMIT;
SUCCESS
SELECT NOTE FROM MVCC_UPDATE_T WHERE ID=3;
NOTE
X

INDEXED COLUMN UPDATE UNDER MVCC
BEGIN;
SUCCESS
UPDATE MVCC_UPDATE_T SET ID=4 WHERE VALUE=20;
SUCCESS
COMMIT;
SUCCESS
SELECT * FROM MVCC_UPDATE_T;
1 | 11 | A
3 | 30 | X
4 | 20 | B
ID | VALUE | NOTE
SELECT * FROM MVCC_UPDATE_T WHERE ID=4;
ID | VALUE | NOTE
4 | 20 | B
